id|business_domain|chartered_capital|license|contact_address|date_of_licence|description|implement_address|implement_comments|implement_due_date|implement_duration|investment_capital|invesment_model|investor|investor_country|issue_date|name|parent_id|visible|activated
1|Xây dựng và kinh doanh một sân Golf đạt tiêu chuẩn quốc tế và các công trình dịch vụ kèm theo gồm khách sạn, nhà nghỉ, nhà hàng, cửa hàng lưu niệm, khu công viên, khu vui chơi của trẻ em, khu thể thao./.|0.00|655/GP-ĐN|thị Trấn Trảng Bom|1993-08-04 00:00:00||Thị Trấn Trảng Bom, huyện Trảng Bom|||50|22729000.00||Bochang International Development Co.,Ltd (75%) và Công ty cổ phần du lịch Đồng Nai (25%).|Đài Loan - Việt Nam|1993-08-04 00:00:00|Công ty TNHH Bochang -  Donatour|||
2|Sản xuất kinh doanh các loại dây dẫn điện bằng nhôm và bằng đồng.|0.00|04A/GPĐC1-ĐN|Trụ sở chính: Xã Phước Thái, huyện Long Thành
VPĐD: Tầng 9, số 01 đường Song Hành Xa Lộ Hà Nội, phường An Phú, Quận 2, Tp. Hồ Chí Minh.|2005-09-05 00:00:00||Xã Phước Thái, Long Thành|||40|3500000.00||Công ty 2000 year Metals|Hàn Quốc|2005-09-05 00:00:00|Công ty TNHH Dây dẫn kim loại Việt Nam|||
3|lai tạo heo giống và kinh doanh heo giống|0.00|05/GP-ĐN|130, QL 1, P.Trảng Dài,tp BH|1997-09-10 00:00:00||huyện Vĩnh Cửu|||30|2336000.00||Công ty liên doanh France Hybrides Việt Nam|Pháp - Việt|1997-09-10 00:00:00|Công ty liên doanh France Hybrides Việt Nam|||
4|Chế biến thuốc lá sợi từ nguồn nguyên liệu trong nước và nhập khẩu.|0.00|2214/GP-ĐN|BH - Kp8, Long Bình|2001-08-17 00:00:00||P. Long Bình, Biên Hòa|||50|65000000.00||Công ty LD Thuốc lá BAT-VINATABA|Anh - Việt Nam|2001-08-17 00:00:00|Công ty LD Thuốc lá BAT-VINATABA|||
5|sx gia công màng nhựa, tấm nhựa các loại , vải tráng phủ keo nhựa, giả da, simili
ít Nhất 50% sản phẩm của Dn để xuât khẩu, số còn lại tiêu tụ tại thị trường Việt Nam|0.00|61ĐN/16.12.02|ấp Long Phú, xã Phước Thái, Long Thành|2001-08-17 00:00:00||ấp Long Phú, xã Phước Thái, Long Thành|||50|3000000.00||Cty TNHH MYUNG SUNG|Hàn Quốc|2001-08-17 00:00:00|Cty TNHH MYUNG SUNG|||
6|SX Sp gỗ gia dụng và linh kiện trang trí nội thất|0.00|471043000089|ấp 8, xã Bình Sơn, h.Long Thành|2007-12-28 00:00:00||ấp 8, xã Bình Sơn, h.Long Thành|||50|25000000.00||Cty TNHH giấy Yuen Fong Yu Đồng Nai|Đài Loan|2007-12-28 00:00:00|Cty TNHH giấy Yuen Fong Yu Đồng Nai|||
7|sx ván ép, ván dăm từ nguồn nguyên liệu gỗ nhập khẩu  chính ngạch, ít nhất 70% sản phẩm của doanh nghiệp để xuất khẩu./.|0.00|85ĐN/07.5.04|KP8, p.Long Bình, tp Biên Hòa|2007-12-28 00:00:00||p.Long Bình, tp Biên Hòa|||30|3000000.00||Cty TNHH LUKS TIMBER VN|Đài Loan|2007-12-28 00:00:00|Cty TNHH LUKS TIMBER VN|||
8|Sản xuất, lắp ráp sản phẩm điện -  điện tử như: máy biến áp, motor, máy phát điện, tụ điện, thiệt bị trong hệ thống an toàn điện, thiết bị máy biến áp, thiết bị động cơ điện và thiết bị của máy phát điện; bảo trì, sửa ch|0.00|471043000417|QL 51, CCN Dốc 47, xã Tam Phước,BH|2014-06-11 00:00:00||Ấp Long Khánh 1, xã Tam Phước, Tp. Biên Hòa|||30|5000000.00||Công ty TNHH Cự Đại Thịnh và các cá nhân sau: Ông Lin Yung Chin, Bà Chen Hui Mei, Bà Su Yu Feng, Ông Chen Huo Ming và Bà Huo Yueh Ya.|Đài Loan|2014-06-11 00:00:00|Công ty TNHH Điện cơ Vĩnh Phong|||
9|Thiết kế, thi công lắp đặt các thiết bị điện máy, thiết bị PCCC, thiết bị điều không, đường ống máy móc của các nhà máy./.|0.00|100ĐN/18.11.05|Nhà số 2, Phòng 414, Chung Cư 5 Tầng, Xã Hiệp Phước, Huyện Nhơn Trạch, Tỉnh Đồng Nai
0613.818.491
Ngày hoạt động: 24/11/2005|2014-06-11 00:00:00||chung cư cao tầng hiệp Phước, h.Nhơn Trạch|||30|300000.00||Công ty Hữu hạn Điện máy Sohwa (VN)|Brunei Darussalam|2014-06-11 00:00:00|Công ty Hữu hạn Điện máy Sohwa (VN)|||
10|Thiết kế thi công lắp đặt hệ thống điều hoà không khí, gió, giải nhiệt./.|0.00|105ĐN/20.01.06|215 Chung Cư Cao Tầng,X. Hiệp Phước, H. Nhơn Trạch, Đồng Nai|2014-06-11 00:00:00||NT- Hiệp Phước|||20|250000.00||Cty LD-DV HAAN LIANG (VN)|Đài Loan|2014-06-11 00:00:00|Công ty LD-DV HAAN LIANG (VN)|||
11|Thi công lắp đặt một số công đoạn của công trình xây dựng nhà xưởng gồm: tự động hoá nhà xưởng, trung tâm điều khiển lập trình bằng chuỗi lý luận, hệ thống thoát nước, hệ thống chữa cháy, hệ thống phát thanh, hệ thống điện, công trình phối ống, công trình|0.00|472022000003|35D/4, khu phố 1, phường Tân Hòa, Tp Biên Hòa.|2006-10-12 00:00:00||35D/4, khu phố 1, phường Tân Hòa, Tp Biên Hòa.|||20|100000.00||Ông Hsieh Chin Teng; Ông Chen Chi Ming và Ông Su feng Tun.|Đài Loan|2006-10-12 00:00:00|Công ty TNHH HUATON|||
12|sản xuât, gia công sản phẩm may mặc xuất khẩu|0.00|472042000004|tổ 19, KP3, P Trảng dài - BH|2006-10-23 00:00:00||P Trảng dài - BH|||20|900000.00||Cty TNHH MJ APPAREL |Hàn Quốc|2006-10-23 00:00:00|Cty TNHH MJ APPAREL|||
13|Trại ấp trứng gà, trại sản xuất gà giống và giao nuôi gia công gà thịt và gà đẻ
giao nuôi gia công heo giống, heo thịt tại những địa điểm nằm trong vùng quy hoạch phát triển chăn nuôi|0.00|471043000005|Hố Nai 3 - TB
VPDD: F5-F6, khu phố 5A, phường Tân Biên, tp Biên Hòa|2006-04-12 00:00:00||Trại ấp trứng gà:Hố Nai 3 - TB
Trại sản xuất gà giống: xã Bắc Sơn, Trảng Bom|||50|8560000.00||Công ty TNHH Emivest Việt Nam|Malaysia|2006-04-12 00:00:00|Trại ấp trứng gà và sản xuất gà giống|||
14|đầu tư nhà máy ấp trứng gà để cung cấp cho các hộ dân và các trang trại chăn nuôi trong nước|0.00|472000001(CN)|Sông Trầu-Trảng Bom
trụ sở chính: xã Nhựt Chánh, huyện Bến Lức, Long an|2006-10-12 00:00:00||Sông Trầu-Trảng Bom|||27|3480000.00||Công ty Japfa Compeed Long An|Singapore|2006-10-12 00:00:00|Nhà máy ấp trứng gà|||
15|Nuôi heo giống và sx tinh  heo|0.00|47112000003 (CN)|xã Nhựt Chánh, huyện Bến Lức, tỉnh Long An|2006-12-08 00:00:00||ấp 10, xã Xuân Tây, huyện Cẩm Mỹ|||47|1159243.00||Công ty cổ phần Greenfeed Việt Nam- chi nhánh giống Cẩm Mỹ|Thái Lan|2006-12-08 00:00:00|Trung tâm  giống - tinh heo Greenfeed - Finnor|||
16|gia công SX mũi giày|0.00|47112000038|KCN NT 1, đường 25B, h.NT
Xưởng gia công: dốc 47, xã Tam Phước, BH|2007-06-12 00:00:00||CCN Dốc 47  -BH (thuê nhà xưởng của Cty CP Đinh Thuận)|đến 04/7/2053||47|2000000.00||Chi nhánh Cty TNHH Hwaseung Vina|Hàn Quốc|2007-06-12 00:00:00|Chi nhánh Cty TNHH Hwaseung Vina|||
17|Thi công xây dựng, lắp đặt điện|0.00|471043000039|ấp Xóm Gốc, xã Long An, h.Long Thành|2006-06-15 00:00:00||ấp Xóm Gốc, xã Long An, h.Long Thành|đến 04/7/2053||20|120000.00||Cty TNHH Công trình xử lý môi trường Chingtse VN|Đài Loan|2006-06-15 00:00:00|Cty TNHH Công trình xử lý môi trường Chingtse VN|||
18|Sản xuất phụ tùng bằng cao su cho xe ôtô và xe gắn máy./.|0.00|471043000040|Cụm công nghiệp Thiện Tân - Thạnh Phú, huyện Vĩnh Cửu.|2007-06-18 00:00:00||Cụm công nghiệp Thiện Tân - Thạnh Phú, huyện Vĩnh Cửu.|đến 04/7/2053||50|6000000.00||Cty TNHH Pantra Techseal Korea|Hàn Quốc|2007-06-18 00:00:00|Công ty TNHH Pantra Techseal Vina|||
19|Sx SP may mặc|0.00|4711200043|ấp Long Phú, xã Phước Thái, Long Thành|2007-07-17 00:00:00||xã Phước Thái-LT|đến 04/7/2053||2|600000.00||Chi nhánh Cty TNHH MJ APPAREL|Hàn Quốc|2007-07-17 00:00:00|Chi nhánh Cty TNHH MJ APPAREL|||
20|Lắp ráp 250.000 chiếc xe máy|0.00|471043000041|khóm 5, p.Tam Hiệp, tp Biên Hòa
vmepdnai@sym-vn.com|2007-06-27 00:00:00||khóm 5, p.Tam Hiệp, tp Biên Hòa|đến 04/7/2053||50|160000000.00||Công ty HH Chế tạo Công nghiệp và gia công chế biến hàng xuất khẩu Việt Nam (VMEP)|Đài Loan|2007-06-27 00:00:00|Công ty HH Chế tạo Công nghiệp và gia công chế biến hàng xuất khẩu Việt Nam (VMEP)|||
21|Nuôi khỉ xuất khẩu và xây dựng công trình phụ trợ (khu nhà tập thể). Quy mô: 200 chuồng trại và xuất khẩu 10.000 con khỉ/năm.|0.00|471023000078|Xã Tam Phước, Tp Biên Hòa|2007-12-06 00:00:00||xã Tam Phước, BH|đến 04/7/2053||50|5200000.00||KHI Capital Limited (60%) và Tổng Công ty Lâm nghiệp Việt Nam (40%)|Hong Kong - Việt Nam|2007-12-06 00:00:00|Công ty LD nuôi và phát triển khỉ Việt Nam (NAFOVANNY)|||
22|sản xuất vỏ bình gas, nhập khẩu gas, các thiết bị, phụ tùng cho yêu cầu đóng bình gas gia dụng, cung cấp và lắp đạt các thiệt bị sử dụng gas cho khách hàng công nghiệp và kinh doanh gas, thực hiện quyền xuất nhập khẩu vỏ bình gas.
Cho thuê nhà xưởng, máy|0.00|471043000082|p.Long Bình Tân, tp Biên Hoa|2007-10-12 00:00:00||p.Long Bình Tân, tp Biên Hoa|đến 04/7/2053||50|18000000.00||Cty TNHH S.C.T GAS Việt Nam|Thái Lan|2007-10-12 00:00:00|Công ty TNHH SCT Gas Việt Nam|||
23|chế biến dăm mảnh gỗ và cảng chuyên dùng cho việc xuất khẩu dăm gỗ, hợp tác trồng rừng tạo nguồn nguyên liệu ổn định cho nhà máy, gia công băm gỗ mảnh|0.00|471023000058|xã Phú Đông, Nhơn Trạch|2007-11-10 00:00:00||xã Phú Đông, Nhơn Trạch|đến 04/7/2053||30|10000000.00||Cty TNHH PHÚ ĐÔNG|Hong Kong|2007-11-10 00:00:00|Cty TNHH PHÚ ĐÔNG|||
24|Sx sp tre nứa, cơ khí tiêu dùng…
kinh doanh xuất nhập khẩu hàng hóa|0.00|47102300055|Kp5, p.Trảng Dài|2007-09-25 00:00:00||Kp5, p.Trảng Dài, BH|đến 04/7/2053||30|1000000.00||Cty TNHH Thánh Phong|Đài Loan|2007-09-25 00:00:00|Cty TNHH Thánh Phong|||
25|Sản xuất và gia công các loại hàng cơ khí, các loại kệ để hàng bằng sắt, thép, inox và kim loại khác, xe đẩy hàng, lồng xếp hàng, các loại mái che công nghiệp, hệ thống hút bụi, hệ thống quạt thông gió, các loại cửa cuốn và sản xuất đũa tre./.
Kinh doanh|0.00|471043000072|Khu phố 5, p.Trảng Dài, tp Biên Hòa|2007-11-20 00:00:00||P. Trảng dài, Biên Hoà|đến 04/7/2053||30|250000.00||Cty TNHH Gia Long|Đài Loan|2007-11-20 00:00:00|Cty TNHH Gia long|||
26|Sx các loại phụ kiện in, ép các loại nhãn mác cho giày.|0.00|471043000049|ấp Tân Hóa, xã Hóa An, tp Biên Hòa|2007-08-14 00:00:00||xã Hóa An, tp Biên Hòa|đến 04/7/2053||20|900000.00||Cty TNHH Thương mại K & P|Hàn Quốc|2007-08-14 00:00:00|Cty TNHH Thương mại K & P|||
27|Sx phớt chắn dầu cho xe ôtô,gắn máy|0.00|471023000018|151, khu 3, ấp 7, xã An Phước, huyện Long Thành|2007-08-05 00:00:00||LT- Long Phước|đến 04/7/2053||50|1500000.00||Cty TNHH  Hân Triển|Đài Loan|2007-08-05 00:00:00|Cty TNHH  Hân Triển|||
28|Sản xuất các sản phẩm gỗ gia dụng và các chi tiết sản phẩm từ nguyên liệu gỗ trong nước hợp pháp và nguyên liệu gỗ nhập khẩu chính ngạch cùng các loại vật liệu khác. Sản xuất các sản phẩm đá grannite dùng cho sản phẩm gỗ. Xây dựng cư xá cho cán bộ công nh|0.00|471043000048|xã Bắc Sơn, Trảng Bom
CN: KCN Biên Hòa 1, tp BH
|2007-08-14 00:00:00||Xã Bắc Sơn, huyện Trảng Bom|đến 04/7/2053||50|30000000.00||Cty TNHH GREAT VECA VN|Đài Loan|2007-08-14 00:00:00|Công ty TNHH GREAT VECA Việt Nam.|||
29|Sx gia công các lọai máy tập thể thao, sản xuất linh kiện giày bằng sợi carbon|0.00|471023000084|108 xã An PHước, Long Thành, Đnai|2007-12-21 00:00:00||LT- An Phước |đến 04/7/2053||50|6200000.00||Cty TNHH Cự Thành|Đài Loan|2007-12-21 00:00:00|Cty TNHH Cự Thành|||
30|Sx sản phẩm may mặc xuất khẩu|0.00|4710430000126|Ấp Long Phú, xã Phước Thái, Long Thành|2007-06-02 00:00:00||LT- Phước Thái|đến 04/7/2053||50|1500000.00||Cty TNHH INDO CHINE|Hàn Quốc|2007-06-02 00:00:00|Cty TNHH INDO CHINE|||
31|SX sản phẩm gỗ gia dụng|0.00|471023000068|Ấp 8, đường 769, CCN Bình Sơn, xã Bình Sơn, huyện Long Thành.|2007-07-11 00:00:00||LT - Bình Sơn|đến 04/7/2053||50|12000000.00||Cty TNHH Quốc tế XIN GUAN XING VN|Đài Loan|2007-07-11 00:00:00|Cty TNHH Quốc tế XIN GUAN XING VN|||
32|Sx, lắp ráp bảo trì các thiết bị dùng cho xử lý chất thải  và sản xuất các sản phẩm xử lý chất thải như chất khử sơn, chất bảo quản lò hơi, chất tẩy rửa, xử lý bề mặt, xử lý ban đầu, thiết bị lọc nước và các sản phẩm khác có liên quan; Tư vấn, hỗ trợ kỹ t|0.00|471023000092|Đường số 9, KCN Tam Phước, xã Tam Phước, tp Biên Hòa, tỉnh Đồng Nai.|2007-12-28 00:00:00||Đường số 9, KCN Tam Phước, xã Tam Phước, tp Biên Hòa, tỉnh Đồng Nai.|đến 04/7/2053||50|400000.00||Cty FINECHEM HƯNG NGHIỆP|Đài Loan|2007-12-28 00:00:00|Công ty FINECHEM HƯNG NGHIỆP|||
33|Thi công xây dựng.|0.00|471023000072|phòng 310 NS2, Chung cư cao tầng Hiệp Phước, KCN Nhơn Trạch 1, huyện NT, Đnai (thue lại nhà của xí nghiệp PT Nhà số 4-Cty CPĐTPT nhà và Đô thị Idico)
319/D14, Lý Thường Kiệt, phường 15, Quận 11, Tp. Hồ Chí Minh|2007-11-16 00:00:00||Hiệp Phước, huyện Nhơn Trạch|đến 04/7/2053||20|1000000.00||Cty TNHH Safety|Đài Loan|2007-11-16 00:00:00|Công ty TNHH Safety|||
34|Kinh doanh sân golf 18 lỗ|0.00|471023000074|Công ty CP Taekwang Vina Industrial số 8, đường 9A, KCN Biên Hòa 2, tp BH|2007-11-22 00:00:00||Cù Lao Đại Phước, xã Đại Phước, huyện Nhơn Trạch, tỉnh Đồng Nai.|đến 04/7/2053||47|60000000.00||Công ty TNHH JEONGSAN VINA|Hàn Quốc|2007-11-22 00:00:00|Dự án sân Golf Jeongsan và Resort|||
35|thi công lắp đặt kết cấu thép, khung nhà|0.00|471043000081|khu A9, khu quy hoạch nhà ở thị trấn Long Thành, huyện Long Thành
Mã số thuế: 3600958054
Địa chỉ: Tổ 9, Khu Cầu Xéo, Thị trấn Long Thành, Huyện Long Thành, Tỉnh Đồng Nai
Đại diện pháp luật: Cho Kwang Yeun
Ngày hoạt động: 20/12/2007 (Đã hoạt động 8 năm)|2007-12-10 00:00:00||Thị trấn Long Thành|đến 04/7/2053||20|100000.00||Cty TNHH  DAEJOO |Hàn Quốc|2007-12-10 00:00:00|Công ty TNHH MTV Daejoo|||
36|Thi công lắp đặt các công trình cơ khí; thi công lắp đặt máy móc thiết bị cơ khí.\.|0.00|471023000087|Số 21, lô A9, KDC An Bình, p.An Bình, tp Biên Hòa|2007-12-21 00:00:00||Số 21, lô A9, KDC An Bình, p.An Bình, tp Biên Hòa|đến 04/7/2053||20|150000.00||Công ty TNHH Kỹ thuật cơ khí Vũ Tường|Đài Loan|2007-12-21 00:00:00|Công ty TNHH Kỹ thuật cơ khí Vũ Tường|||
316|Sx tôn mạ màu|0.00|1264/GP|061-3836614-061-836698|1995-06-09 00:00:00||KCN2|||50|45680000.00||Southern Steel Co., Ltd|VN-Malaysia-Nhật Bản|1995-06-09 00:00:00|Cty Tôn Phương Nam|||
37|thi công lắp đặt hệ thống điện dân dụng, công nghiệp|0.00|471023000090|phòng 306 lầu 3, chung cư số 1, chung cư cao tầng Hiệp Phước, KCN Nhơn Trạch, Đnai|2007-12-28 00:00:00||Hiệp Phước-Nhơn Trạch|đến 04/7/2053||15|150000.00||Công ty TNHH Vũ Thành|Đài Loan|2007-12-28 00:00:00|Công ty TNHH Vũ Thành|||
38|Thi công, lắp đặt, sửa chữa máy móc, hệ thống điện, hệ thống thông gió cho các công trình công nghiệp (thực hiện tại công trình)./.|0.00|471023000091|12A/A8, đường 10, khu dân cư An Bình, p.An Bình|2007-12-28 00:00:00||12A/A8, đường 10, khu dân cư An Bình, p.An Bình|đến 04/7/2053||20|100000.00||Công ty TNHH một thành viên cơ điện Việt Tú|Trung Quốc|2007-12-28 00:00:00|Công ty TNHH một thành viên cơ điện Việt Tú.|||
39|Triển khai thực hiện dự án cấp 2 bao gồm: đầu tư  xây dựng, bán hoặc cho thuê chugn cư, khu nhà ở biệt thự, trung tâm thương mại cùng với những tiện nghi cao cấp; Kinh doanh bất động sản bao gồm đầu tư, xây dựng, quản lý, kinh doanh và phát triển, bán hoặ|0.00|47103300069|Công ty CP Vina Đại Phước 
(16-18, Hai Bà Trưng, phường Bến Nghé, q.1, TPHCM), ĐT: 08 3827 3929, Fax: 08 .827 3928|2007-11-15 00:00:00||Cù lao Ông Cồn, xã Đại Phước, huyện Nhơn Trạch.|đến 04/7/2053||50|400000000.00||Cty Cổ phần Vina Đại Phước|Singapore - Việt Nam|2007-11-15 00:00:00|Hoa sen Đại Phước của Công ty Cổ phần Vina Đại Phước|||
40|đầu tư xây dựng chung cư cao tầng , khách sạn, dịch vụ, thương mại, văn phòng cao tầng để bán hoặc cho thuê|0.00|47124000071|101 Dân Chủ, P.Bình Thọ, Q.Thủ Đức|2007-11-16 00:00:00||xã Phú Hội, huyện Nhơn  Trạch|đến 04/7/2053||50|47000000.00||Cty Thái Dương - Sunco|Malaysia - Việt Nam|2007-11-16 00:00:00|Khu cao ốc liên hợp trung tâm thành phố Nhơn Trạch|||
41|đầu tư xây dựng khu dân cư đô thị theo quy hoạch nhằm đáp ứng nhu cầu nhà ở cho các đối tượng có nhu cầu|0.00|47122000070|số 8, đường 9A, KCN Biên Hòa 2, tp BH|2007-11-15 00:00:00||xã Long Tân, Phú Hội, huyện Nhơn Trạch|đến 04/7/2053||50|290000000.00||Cty Taekwang Vina|Hàn Quốc|2007-11-15 00:00:00|Khu dân cư Long Tân - Phú Hội (Dự án chưa triển khai)|||
42|Sx băng từ, SP điện tử, Sp nhựa dùng trong sp điện tử
thực hiện quyền xuất khẩu và nhập khẩu các mặt hàng : máy điều hòa, tủ lạnh, máy giặt các sản phẩm điện tử dân dụng, công nghiệp…|0.00|471043000111|xa lộ Hà Nội, P.Tân Biên, Biên Hòa, Đnai
983 Trần Hưng Đạo, Q.5, TP HCM |2008-05-19 00:00:00||BH Tân Biên |đến 04/7/2053||30|11600000.00||Cty Điện và Điện tử TCL (Việt Nam)|Anh|2008-05-19 00:00:00|Cty Điện và Điện tử TCL (Việt Nam)|||
43|SX 36.000T bột ngọt, 37.400T NAOH
thực hiện quyền xuất khẩu và nhập,khẩu hàng hóa
Thực hiên quyền phân phối bán buôn và phân phối bán lẻ (không gắn với việc thành lập cơ sở bán buôn, cơ sở bán lẻ).
Sản xuất nước đường, mở rộng thêm phần sản xuất đường mal|0.00|471033000143|QL 51, ấp 1A, xã Phước thái, Long Thành|2008-06-30 00:00:00||QL 51, ấp 1A, xã Phước thái, Long Thành|đến 04/7/2053||50|563245336.00||Ctu CP HH Vedan Việt Nam|Đài Loan|2008-06-30 00:00:00|Cty CP HH Vedan Việt Nam|||
44|SX  văn phòng phẩm, băng keo, film PP, film PVX và bao bì, thùng carton phục vụ cho việc đóng gói thành phẩm xuất khẩu của Công ty.|0.00|471043000131|cây số 80, QL 1A, phường Xuân Bình, tx Long Khánh|2008-06-30 00:00:00||cây số 80, QL 1A, phường Xuân Bình, tx Long Khánh|đến 04/7/2053||50|11610000.00||  Cty TNHH  DONGYANG VN|Hàn Quốc|2008-06-30 00:00:00|Cty TNHH  DONGYANG VN|||
45|Lai tạo giống F1 dưa, rau quả, hạt hoa cỏ cảnh; Nhập khẩu giống mới dưa, rau, hạt cỏ cảnh để trồng thử nghiệm và kinh doanh cung ứng các loại giống mới về dưa, rau quả, hạt hoa cỏ cảnh, vật tư thiết bị nông nghiệp tại thị|0.00|4710430000110|xã Long An, Huyện Long Thành|2008-05-13 00:00:00||xã Long An, Huyện Long Thành|20
(Hết hạn ngày 01/06/2017)||50|1800000.00||Công ty TNHH Know You Seed|Đài Loan|2008-05-13 00:00:00|Công ty Giống Cây trồng Nông Hữu TNHH|||
46|SX men, phụ gia thực phẩm, các lọai thực phẩm
sản xuất phân bón
thực hiện quyền xuất khẩu, nhập khảu nguyên liệu, hóa chất, phụ gia cho ngành công nghiệp chế biến thực phẩm các sản phẩm chế biến từ nông sản thực phẩm|0.00|471023000130|xã La Ngà, Định Quán|2008-06-30 00:00:00||xã La Ngà, Định Quán|20
(Hết hạn ngày 01/06/2017)||30|22564000.00||Cty TNHH AB Mauri Việt Nam|Úc|2008-06-30 00:00:00|Cty TNHH AB Mauri Việt Nam|||
47|sản xuất DOP
thực hiện quyền xuất khẩu và nhập khẩu các sản phẩm hóa chất|0.00|471023000144|Cty TNHH Hóa Chất LG Vina (xã Phước Thái, huyện Long Thành)
VP: lầu 11, sunwah Tower, 115 Nguyễn Huệ, Quận 1, tp HCM
Khu bồn chứa: KCN Gò Dầu, huyện Long Thành|2008-06-30 00:00:00||xã PHước Thái,Long Thành|20
(Hết hạn ngày 01/06/2017)||20|13050000.00||Cty TNHH Hoá chất LG Vina|Hàn Quốc|2008-06-30 00:00:00|Cty TNHH Hoá chất LG Vina|||
48|Sx và gia công sản xuất các chất phụ gia thức ăn chăn nuôi, các loại thuốc thú y,
Dịch vụ tư vấn trong ngành chăn nuôi gồm: tư vấn kỹ thuật chăn nuôi, làm công thức thức ăn chăn nuôi, phân tích mẫu thức ăn chăn nuôi.
Thực hiện quyền nhập khẩu và phân phối|0.00|471043000137|238, QL 1A, P.Tân Hiệp, Biên Hòa|2008-06-30 00:00:00||238, QL 1A, P.Tân Hiệp, Biên Hòa|20
(Hết hạn ngày 01/06/2017)||40|1200000.00||Cty NUTRIWAY VIỆT NAM (nay là Promivi)|Hà Lan|2008-06-30 00:00:00|Cty TNHH MTV Promivi|||
49|SX các sản phẩm sử dụng một lần bằng giấy, vải không dệt.|0.00|471023000139|Thôn Tây Lạc, xã Bắc Sơn, h.Trảng Bom|2008-06-30 00:00:00||Thôn Tây Lạc, xã Bắc Sơn, h.Trảng Bom|20
(Hết hạn ngày 01/06/2017)||30|5184400.00||Cty TNHH YAHON|Đài Loan|2008-06-30 00:00:00|Cty TNHH YAHON|||
50|Sx, gia công bao bì giấy cao cấp|0.00|471023000121|Ấp HỐ Nai 3, h.Thống Nhất|2008-06-25 00:00:00||Ấp HỐ Nai 3, h.Thống Nhất|20
(Hết hạn ngày 01/06/2017)||48|7897003.00||Cty TNHH Bao bì Giấy HONG CHANG|Đài Loan|2008-06-25 00:00:00|Cty TNHH Bao bì Giấy HONG CHANG|||
51|Thi công xây dựng|0.00|471023000140|179B. Đường Đồng Khởi, phường Tân Mai, tp BH (thuê nhà của ông Nguyễn Tấn Hải)
357A/4, Nguyễn Trọng Tuyển,P.1, Q.Tân Bình|2008-06-30 00:00:00||BH Tân Mai|20
(Hết hạn ngày 01/06/2017)||30|1500000.00||Cty TNHH Xây dựng Đường Thành|Đài Loan|2008-06-30 00:00:00|Cty TNHH Xây dựng Đường Thành|||
52|Sx đồ chơi trẻ em, sản phẩm trang trí, xây dựng bằng nhựa, sắt, thạch cao…|0.00|471023000098|Ấp HỐ Nai 3, h.Thống Nhất|2008-01-31 00:00:00||Ấp Hố Nai 3, huyện Trảng Bom|20
(Hết hạn ngày 01/06/2017)||25|500000.00||Cty TNHH Hoa Nghi|Đài Loan|2008-01-31 00:00:00|Cty TNHH Hoa Nghi|||
53|kinh doanh thể thao bowling|0.00|471043000133|34, Lê Duẩn, P.Bến Nghé, TP HCM (Diamond Plaza)
trụ sở giao dịch: số 21/57 khu phố 8, phường Tam Hiệp, tp Biên Hòa, Đnai|2008-06-30 00:00:00||Siêu thị BigC, tầng 1, p.Long Bình Tân, BH|20
(Hết hạn ngày 01/06/2017)||25|2391000.00||Cty TNHH SUPERBOWL VN|Singapore|2008-06-30 00:00:00|Cty TNHH SUPERBOWL VN|||
54|đóng bình gas, sản xuất bình chứa gas|0.00|471043000102|Cảng Gò Dầu A, xã Phước Thái, h.Long Thành
mrhungktcn@gmail.com|2008-05-02 00:00:00||cảng Gò Dầu, xã Phước Thái, h.Long Thành|20
(Hết hạn ngày 01/06/2017)||30|6000000.00||Cty TNHH SUPER GAS - VN|Thái Lan|2008-05-02 00:00:00|Cty TNHH SUPER GAS - VN|||
55|sx khuôn mẫu, gá kiểm, đồ gá dùng trong công nghiệp và XD|0.00|471043000134|436, tổ 17,xóm 2, ấp Thái Hòa, Hố Nai 3, Trảng Bom, Đnai|2008-06-30 00:00:00||TB-Hố Nai|20
(Hết hạn ngày 01/06/2017)||50|3000000.00||Cty HH CN Đức Phát|Đài Loan|2008-06-30 00:00:00|Cty HH CN Đức Phát|||
56|Sx gia công hàng may mặc|0.00|471043000130|Ấp Long Khánh I, Xã Tam Phước, H.Long Thành|2008-06-30 00:00:00||359, ấp Long Khánh I, H.Long Thành|20
(Hết hạn ngày 01/06/2017)||35|650000.00||Cty TNHH RIO Vina|Hàn Quốc|2008-06-30 00:00:00|Cty TNHH RIO Vina|||
57|tồn trữ, đóng bình và tiêu thụ LPG, thiết kế, lắp đặt, bảo hành, bảo trì thiết bị sử dụng LPG cho khách hàng, cho thuê bồn chứa LPG,
Thực hiện quyền xuất khẩu, nhập khẩu LPG và các thiết bị sử dụng LPG|0.00|471023000136|Cty TNHH Gas Sopet
Trụ sở chính: ấp 2, xã Phước Khánh, h.NT
VPGD: lầu , Broadway C Phú Mỹ Hưng, 150 nguyễn Lương Bằng, p.Tân Phú, tp HCM|2008-06-30 00:00:00||ấp 2, xã Phước Khánh, NT|20
(Hết hạn ngày 01/06/2017)||44|5440000.00||Công ty Sopet Gas One|Singapore|2008-06-30 00:00:00|Công ty Sopet Gas One|||
58|sx sản phẩm cơ khí dùng trong công nghiệp, dân dụng|0.00|471023000115|khu 2, ấp Bình Thạch, xã Bình Hòa, Vĩnh Cửu|2008-04-06 00:00:00||khu 2, ấp Bình Thạch, xã Bình Hòa, Vĩnh Cửu|20
(Hết hạn ngày 01/06/2017)||40|6500000.00||Cty TNHH HEADER PLAN|Đài Loan|2008-04-06 00:00:00|Cty TNHH HEADER PLAN|||
