id|business_domain|chartered_capital|license|contact_address|date_of_licence|description|implement_address|implement_comments|implement_due_date|implement_duration|investment_capital|invesment_model|investor|investor_country|issue_date|name|parent_id|visible|activated
207|Thiết kế, chế tạo, gia công các loại khuôn mẫu cho các SP nhựa và kim loại. Sx và lắp ráp các sản phẩm từ các loại khuôn mẫu do doanh nghiệp SX. Sx dữ liệu CAD, dây điện, thiết bị sạc pin của điện thoại di động.|0.00|48/GP-KCN-ĐN|061-3936636-061-3936637|2000-07-17 00:00:00||KCN1|||50|2853000.00||Sanko Mold Viet Nam Co., Ltd|Nhật Bản|2000-07-17 00:00:00|Công ty TNHH Sanko Mold Việt Nam|||
208|Sản xuất trục xích lăn, phụ kiện xích các loại, ốc vít, dây thép tròn và dây thép dẹt|0.00|58/GP-KCN-ĐN|061 - 3893867~6-061 - 893477|2000-10-27 00:00:00||KCN1|||50|3600000.00||Kao-Meng Mechinery (VietNam) Co., Ltd|Bristish Virgin Island|2000-10-27 00:00:00|Công ty TNHH Cơ khí Kao- Meng (Việt Nam)|||
209|SX bàn đạp xe đạp, các bộ phận của bàn đạp, các chi tiết bằng nhựa của xe đạp|0.00|61/GP-KCN-ĐN|061 - 3893786 / 787-061 - 893488|2000-12-11 00:00:00||KCN1|||50|5600000.00||Components (VietNam) Co., Ltd|Mỹ|2000-12-11 00:00:00|Công ty TNHH VP Components (Việt Nam)|||
210|SX nam châm và các chi tiết của nam châm|0.00|70/GP-KCN-ĐN|061-3936671-675-061-936672|2001-01-19 00:00:00||KCN1|||50|6356148.00||Magx Viet Nam Ltd|Nhật Bản|2001-01-19 00:00:00|Công ty TNHH Magx Việt Nam|||
211|SX màng film CPP, PE, VMOPP, VMOPP và VMPET|0.00|89/GP-KCN-ĐN|061-3936178/179/174-061-3936180|2001-08-22 00:00:00||KCN1|||50|26600000.00||Reliable Plastic (VietNam) Join-Stock Company|Đài Loan-British Virgin Islands|2001-08-22 00:00:00|Công ty CP Nhựa Reliable (Việt Nam)|||
212|SX bao bì, In sách truyện thiếu nhi xuất khẩu, in gia công truyện thiếu nhi cho các nhà sx trong nước, in catalogue kỹ thuật, thương mại, thiếp, tờ rời, tờ gấp, áp phích có nội dung không phải là các xuất bản phẩm|0.00|93/GP-KCN-ĐN|061-3991046/047/048-061-991018|2001-10-15 00:00:00||KCN1|||50|11000000.00||Starprint Vietnam Co., Ltd|Thái Lan|2001-10-15 00:00:00|Cty TNHH Starprint Việt Nam|||
213|Sx, gia công chăn, gối, nệm, may mặc hàng dệt, tơ sợi, sản phẩm trang trí nội thất.. Thực hiện quyền xuất khẩu, nhập khẩu|0.00|94/GP-KCN-ĐN|061-3991494-061-991496|2001-10-19 00:00:00||KCN1|||50|2060000.00||Arai Vietnam Co., Ltd|Nhật Bản|2001-10-19 00:00:00|Cty TNHH Arai Việt Nam|||
214|Sx các sản phẩm may mặc. Thi công xây dựng công trình dân dụng và công nghiệp.|0.00|100/GP-KCN-ĐN|061-3991418/422-061-991423|2001-11-29 00:00:00||KCN1|||50|12000000.00||Namyang International Vietnam Co., Ltd|Hàn Quốc|2001-11-29 00:00:00|Cty TNHH Namyang International Việt Nam|||
215|Sx mỹ phẩm, bao bì mỹ phẩm, dụng cụ phụ trợ cho việc sử dụng mỹ phẩm, sản xuất bộ kết nối điện.|0.00|101/GP-KCN-ĐN|061-3892961-|2001-11-29 00:00:00||KCN1|||50|4694567.00||Figla-Viet Nam Co., Ltd|Nhật Bản|2001-11-29 00:00:00|Cty TNHH Figla - Việt Nam|||
216|Sx các loại hóa chất làm sạch, đánh bóng và phủ bề mặt k.loại, nhựa. Thực hiện quyền xuất khẩu, nhập khẩu.|0.00|107/GP-KCN-ĐN|061-3936569/68/987-061-991570|2002-01-14 00:00:00||KCN1|||50|1000000.00||Auromex Viet Nam Company Limited|Thái Lan|2002-01-14 00:00:00|Cty TNHH Okuno - Auromex Việt Nam|||
217|Sx linh kiện điện tử và một số sản phẩm có liên quan|0.00|127/GP-KCN-ĐN|061-3991993-061-892987|2002-05-07 00:00:00||KCN1|||50|1050000.00||K.Y Seritech Viet Nam Company Limited|Canada|2002-05-07 00:00:00|Cty TNHH K.Y Seritech Việt Nam (ngưng hoạt động)|||
218|Dịch vụ nấu ăn cung cấp cho doanh nghiệp, nấu ăn tại bếp doanh nghiệp|0.00|129/GP-KCN-ĐN|061-3936599-061-3936576|2002-05-17 00:00:00||KCN1|||50|40000.00||Amata foods service and supply Co., Ltd|Nhật Bản|2002-05-17 00:00:00|Cty TNHH Amata foods service and supply (ngưng hoạt động)|||
219|Sx phụ tùng bằng kim loại dùng cho xe ôtô, xe gắn máy. Thực hiện quyền xuất khẩu, quyền nhập khẩu.|0.00|134/GP-KCN-ĐN|061-3936821-061-3936826|2002-06-13 00:00:00||KCN1|||50|35157093.00||New Viet nam Co., Ltd|Nhật Bản|2002-06-13 00:00:00|Cty TNHH New Việt Nam|||
220|Sx các sp nhựa dùng cho bảng phân phối, phụ tùng xe ôtô, Sx khuôn các loại dùng cho sp nhựa. Sx các sp nhựa dùng cho ngành điện, điện tử và các loại MMTB. Sx các sp nhựa dùng cho ngành xây dựng.Sx các sp văn phòng phẩm.|0.00|137GP-KCN-ĐN|061-3892955-061-3892957|2002-06-19 00:00:00||KCN1|||50|5000000.00||Fukuyama Grosei (Vietnam) Co., Ltd|Nhật Bản|2002-06-19 00:00:00|Cty TNHH Fukuyama Gosei (Việt Nam)|||
221|Sx quần áo len các loại|0.00|146/GP-KCN-ĐN|061-3991758-061-3991701|2002-08-09 00:00:00||KCN1|||50|10500000.00||Jiangsu Jing Meng (Vietnam) Co., Ltd|Đài Loan|2002-08-09 00:00:00|Cty TNHH Jiangsu Jing Meng (Việt Nam)|||
222|Sx mũ các loại (trừ mũ bảo hiểm), túi xách và thú nhồi bông và các sản phẩm may mặc. Sx bán thành phẩm nón mũ các loại (trừ nón bảo hiểm), túi xách, thú nhồi bông và các sản phẩm may mặc.|0.00|148/GP-KCN-ĐN|061-3936224-061-3936072|2002-08-26 00:00:00||KCN1|||50|7015000.00||Unipax Co., Ltd|Hàn Quốc|2002-08-26 00:00:00|Cty TNHH Unipax|||
223|Sx xe đạp, xe đạp điện và các linh kiện, phụ tùng có liên quan|0.00|149/GP-KCN-ĐN|061-3891792-061-891921|2002-08-29 00:00:00||KCN1|||50|6000000.00||Liyang (VietNam) Industrial Co., Ltd|Đài Loan|2002-08-29 00:00:00|Cty TNHH Công nghiệp Li yang (Việt Nam) (đang giải thể)|||
224|Chế biến các loại hải sản. Thực hiện quyền xuất khẩu, nhập khẩu.|0.00|167/GP-KCN-ĐN|061-3892976-061-3892977|2002-10-31 00:00:00||KCN1|||50|25000000.00||Amata Foods (Vietnam) Limited|Singapore|2002-10-31 00:00:00|Cty TNHH Thực phẩm Amanda (Việt Nam)|||
225|Sx các chất tạo màu, các loại sơn và một số sp có liên quan dùng trong xây dựng công nghiệp và dân dụng; sx mực in. Thực hiện quyền xuất khẩu, nhập khẩu và phân phối.|0.00|173/GP-KCN-ĐN|061-3936186-061-3936185|2002-11-08 00:00:00||KCN1|||50|400000.00||The Valspar (Vietnam) Corporation Limited|Mỹ|2002-11-08 00:00:00|Cty TNHH Valspar (Việt Nam)|||
226|Sx, gia công các bộ dây dẫn lắp đặt trong các sp điện gia dụng, gia công, lắp ráp các bộ phận của sản phẩm gia dụng, sx gia công các loại khuôn đúc (nhựa, kim loại) để sx sp gia dụng|0.00|179/GP-KCN-ĐN|0613-936966-061-3936967|2002-11-27 00:00:00||KCN1|||50|1000000.00||Heiwa Shoji Vietnam Co., Ltd|Nhật Bản|2002-11-27 00:00:00|Cty TNHH Heiwa Shoji Việt Nam|||
228|Xử lý bề mặt và gia công cán mỏng kim loại; Sx các sp từ nhựa và cao su tổng hợp, sx các loại khuôn polyme khoáng chất và sp bằng kim loại nhựa từ khuôn polyme khoáng chất, sx các sp cao cấp dùng cho nhà bếp…Thực hiện quyền xuất khẩu và nhập khẩu|0.00|221/GP-KCN-ĐN|061-3936155-061-3936089|2003-06-18 00:00:00||KCN1|||50|5150000.00||Vietnam Shine Co., Ltd|Nhật Bản|2003-06-18 00:00:00|Cty TNHH Việt Nam Shine|||
229|Sx và gia công gối, đệm và hàng may mặc, gia công, lắp ráp các sản phẩm trang trí nội thất và ngoài trời.|0.00|238/GP-KCN-ĐN|061-3992722-061-992722|2003-09-26 00:00:00||KCN1|||50|570000.00||Vietnam International Production Ltd|Áo|2003-09-26 00:00:00|Cty TNHH Viet Nam  International Production|||
230|Sx các loại nước giải khát chất lượng cao sử dụng chủ yếu nguyên liệu trong nước|0.00|243/GP-KCN-ĐN|061-3936493-061-3936348|2003-10-31 00:00:00||KCN1|||50|39500000.00||San Miguel (Vietnam) Company Limited|Bristish Virgin Island|2003-10-31 00:00:00|Cty TNHH San Miguel (Việt Nam)|||
231|Sx các loại mũ vải, bao tay bằng sợi, khăn choàng, khăn tay, túi xách, tạp dề, ô, giày vải và quần áo.|0.00|258/GP-KCN-ĐN|061-3936420-061-3936419|2003-12-30 00:00:00||KCN1|||50|1600000.00||Emerald Blue Vietnam Co., Ltd|Nhật Bản-TQuốc|2003-12-30 00:00:00|Cty TNHH Emerald Blue Việt Nam|||
232|Sx các loại mực in, miếng phủ bằng cao su, ống bọc giảm xóc, dung dịch cho ống mực dùng cho các loại máy in offset, các loại cao dán dùng dát mỏng phim, các chất sơn phủ và dầu bóng chống gỉ sét dùng để phủ bên ngoài các vỏ lon, vỏ hộp;Thực hiện quyền xuất khẩu và nhập khẩu, quyền phân phối|0.00|262/GP-KCN-ĐN|061-3936647/8-061-3936649|2004-01-02 00:00:00||KCN1|||50|1750000.00||Toyo Ink Vietnam Co., Ltd|Singapore|2004-01-02 00:00:00|Cty TNHH Toyo Ink Việt Nam|||
233|Sx các loại trang phục đi mưa (quần, áo, nón…) và các sản phẩm may mặc.Thực hiện quyền xuất khẩu, nhập khẩu|0.00|265/GP-KCN-ĐN|061-3936638/40-061-3936641|2004-01-16 00:00:00||KCN1|||50|789715.00||Okamoto Vietnam Co., Ltd|Trung Quốc (Hồng Kông)|2004-01-16 00:00:00|Cty TNHH Okamoto Việt Nam|||
234|Thiết kế, phát triển phần mềm tin học; cung cấp dịch vụ phần cứng, cung cấp dịch vụ phần mềm; thực hiện quyền xuất khẩu, quyền nhập khẩu|0.00|271/GP-KCN-ĐN|-|2004-02-25 00:00:00||KCN1|||50|4000000.00||Goodwill Engineering Vietnam, INC|Nhật Bản|2004-02-25 00:00:00|Cty TNHH Công nghệ Goodwill Việt Nam (trước là Kỹ thuật Fusione Việt Nam) (đã chuyển trụ sở chính về TP.HCM)|||
235|Sx các loại vải giả da và tấm PVC mềm|0.00|1946/GP|061-3936680-81-83-84-85-88-89-90-061-936682-86-87|1997-07-12 00:00:00||KCN1|||50|36000000.00|||Đài Loan|1997-07-12 00:00:00|Chi nhánh Cty TNHH CN Nhựa Phú Lâm|||
236|Sx các sp may mặc (bao gồm công đoạn in trên sản phẩm của Cty). Thực hiện quyền xuât khẩu, nhập khẩu.|0.00|284/GP-KCN-ĐN|061-3993923-061-3993924|2004-04-23 00:00:00||KCN1|||50|2500000.00||Asia Garment Manufactures (Vietnam) Co., Ltd|Singapore|2004-04-23 00:00:00|Cty TNHH Asia Garment Manufacturer Việt Nam (DN Chế xuất)|||
237|Sx các loại hóa chất dùng ngành dệt nhuộm, ngành giấy, ngành sơn, ngành mỹ phẩm và các loại hoá chất tẩy rửa. Thực hiện quyền xuất khẩu, quyền nhập khẩu|0.00|298/GP-KCN-ĐN|061-3936041/080/081-061-3936040|2004-06-25 00:00:00||KCN1|||50|3500000.00||Nicca Vietnam Co., Ltd|Nhật Bản-Hong Kong|2004-06-25 00:00:00|Cty TNHH Nicca Việt Nam|||
238|Sx các loại linh kiện, phụ tùng dùng cho xe ô tô và xe chuyên dùng, SX các sp nhôm dùng cho công nghiệp và dân dụng, sx các loại dàn kéo, thiết bị rơ moóc, các loại bồn chứa chuyên dụng và thùng xe. Thực hiện quyền xuất khẩu, nhập khẩu.|0.00|301/GP-KCN-ĐN|061-3936181-061-3936398|2004-07-02 00:00:00||KCN1|||50|3000000.00||BMB Co., Ltd|Đài Loan|2004-07-02 00:00:00|Cty TNHH BMB (đã xây dựng xong nhà xưởng nhưng chưa hoạt động)|||
239|Sx các thiết bị chắn kín bằng kim loại và nhựa. Thực hiện quyền xuất khẩu, nhập khẩu.|0.00|310/GP-KCN-ĐN|061-994311-061-3936398|2004-08-04 00:00:00||KCN1|||50|75000000.00||Vietnam Nok Co., Ltd|Nhật Bản|2004-08-04 00:00:00|Cty TNHH Việt Nam Nok|||
240|Sx các loại bàn ghế dùng cho hội trường, nhà hát, trường học (sử dụng nguồn gỗ nhập khẩu chính ngạch), sản xuất các chi tiết của hệ thống ghế chuyển động bằng điện…|0.00|313/GP-KCN-ĐN|061-3936272/273-061-3936275|2004-08-17 00:00:00||KCN1|||50|2500000.00||Kotobuki Sea Co., Ltd|Nhật Bản|2004-08-17 00:00:00|Cty TNHH Kotobuki Sea|||
241|Sx các loại kính chiếu hậu, chi tiết kính chiếu hậu dùng cho xe ô tô và xe gắn máy. Sx các sản phẩm nhựa gia dụng và công nghiệp. Cho thuê nhà xưởng dôi dư. Thực hiện quyền xuất khẩu, quyền nhập khẩu|0.00|316/GP-KCN-ĐN|061-3936957-061-3936959|2004-09-01 00:00:00||KCN1|||50|1000000.00||Rally's Mirror Co., Ltd|Nhật Bản|2004-09-01 00:00:00|Cty TNHH Rallys Mirror (ngưng hoạt động)|||
242|Sx đồ lót và quần áo bơi, lặn|0.00|322/GP-KCN-ĐN|-|2004-10-04 00:00:00||KCN1|||50|833000.00||Aura Lingerie Co., Ltd|Trung Quốc|2004-10-04 00:00:00|Cty TNHH Aura Lingerie|||
243|Sx, gia công vớ (bít tất) các loại|0.00|20/GPĐC4-KCN-ĐN|-|2004-09-17 00:00:00||KCN1|||50|2200000.00||New Chi Mei Stocking Co., Ltd|Đài Loan|2004-09-17 00:00:00|Cty TNHH Tân Chi Mei|||
244|Sản xuất các loại nến|0.00|324/GP-KCN-ĐN|061-3993987-061-993986|2004-10-12 00:00:00||KCN1|||50|4000000.00||Fleming International Vietnam Limited|Bristish Virgin Island|2004-10-12 00:00:00|Cty TNHH Quốc tế Fleming Việt Nam|||
245|Sản xuất các sản phẩm nhựa dùng trong xây dựng và văn phòng. Thực hiện quyền xuất khẩu, nhập khẩu, quyền phân phối.|0.00|328/GP-KCN-ĐN|061-3936055-061-3936056|2004-10-27 00:00:00||KCN1|||50|2370000.00||Sakaguchi Plastic Vietnam Co., Ltd|Nhật Bản|2004-10-27 00:00:00|Cty TNHH Nhựa Sakaguchi Việt Nam|||
246|Sx, lắp đặt, bảo trì các thiết bị phòng cháy, chữa cháy, thiết bị thoát hiểm|0.00|331/GP-KCN-ĐN|061-3936562-061-3936563|2004-11-18 00:00:00||KCN1|||50|1500000.00||Yp Rex Viet Nam Co., Ltd|Nhật Bản|2004-11-18 00:00:00|Cty TNHH YP Rex Việt Nam (cũ là Cty TNHH Meguro Việt Nam)|||
247|Sx các loại bệ, khung, giá đỡ bằng kim loại dùng cho các máy sx thiết bị bán dẫn, thiết bị tinh thể lỏng, máy tự động trong nhà máy, người máy công nghiệp và máy tiết kiệm lao động, sx các sp bằng kim loại, các chi tiết bằng nhựa trong máy CN. SX lắp ráp MMTB và linh kiện, phụ tùng của MMTB phục vụ SX CN. Sản xuất lắp ráp hàng thủ công, hàng lưu niệm (móc khóa, dây đeo điện thoại); chế biến nông sản , sx lắp ráp hàn gthu3 công, hàng lưu niệm. Thực hiện quey62n phân phối.|0.00|341/GP-KCN-ĐN|061-3994330-061-994334|2004-12-27 00:00:00||KCN1|||50|3000000.00||Shiogai Seiki Vietnam Co., Ltd|Nhật Bản|2004-12-27 00:00:00|Cty TNHH Shiogai Seiki Việt Nam|||
248|Nhà thép tiền chế|0.00|1937/GPĐC6-KCN-HN|061-3936888-061-3936889|2004-12-29 00:00:00||KCN1|||50|0.00|||Channel Islands- Nhật Bản|2004-12-29 00:00:00|Chi nhánh Cty TNHH Nhà thép tiền chế-Zamil Việt Nam|||
249|Sx các loại hạt nguyên liệu dùng trong ngành sản xuất giày và các loại hạt nhựa tổng hợp. Thực hiện quyền xuất khẩu, quyền nhập khẩu và quyền phân phối|0.00|357/GP-KCN-ĐN|061-3936345-061-3936350|2005-02-15 00:00:00||KCN1|||50|7000000.00||Buwon Vina Co., Ltd|Hàn Quốc|2005-02-15 00:00:00|Cty TNHH Buwon Vina|||
250|Sx các loại sơn và dung môi tổng hợp|0.00|40/GPĐC2-ĐN-KCN|061-3936666-061-3936388|2005-02-12 00:00:00||KCN1|||50|730533.00||I Ping Chemical Industrial Co., Ltd|Guine-Bissau-Đài Loan|2005-02-12 00:00:00|Cty TNHH CN Sơn Nhất Phẩm (I Ping Chemical)|||
251|Sx các loại đĩa CD và DVD (đĩa chưa ghi thông tin). Đòng gói và gia công in trực tiếp trên bề mặt bán thành phẩm nhập khẩu (chưa ghi thông tin) để xuất khẩu.|0.00|360/GP-KCN-ĐN|061-3936111-061-936112|2005-03-02 00:00:00||KCN1|||50|160000000.00||Ritek Vietnam Co., Ltd|Đài Loan|2005-03-02 00:00:00|Cty TNHH Ritek Việt Nam|||
252|Sx các loại khuôn đúc và các sản phẩm từ khuôn đúc. Sx và lắp ráp các thiết bị xiết đinh ốc liên hoàn.|0.00|365/GP-KCN-ĐN|061-3936301/02-0613-3936300|2005-03-16 00:00:00||KCN1|||50|4772000.00||Muro Tech Vietnam Corporation|Nhật Bản|2005-03-16 00:00:00|Cty TNHH Kỹ thuật Muro Việt Nam (DN chế xuất)|||
253|Sx các loại sơn, véc-ni, nhựa tổng hợp, vật liệu chống cháy. Sx các loại mực, màu dùng trong ngành dệt nhuộm, thi công sơn công trình xây dựng. Cho thuê nhà xưởng.|0.00|367/GP-KCN-ĐN|061-3992961-0613-3992972|2005-03-21 00:00:00||KCN1|||50|15000000.00||Yung Chi Paint & Varnish MFG (Vietnam)., Ltd|Đài Loan|2005-03-21 00:00:00|Cty TNHH Yung Chi Paint & Varnish MFG (Vietnam)|||
254|Sx các sản phẩm tổng hợp nguyên liệu chính là dầu hạt điều dùng cho phanh (thắng) và bộ phận ly  hợp của xe ô tô và xe gắn máy. Thực hiện quyền xuất khẩu và nhập khẩu|0.00|375/GP-KCN-ĐN|061-3936014/015-061-3936016|2005-04-11 00:00:00||KCN1|||50|2450000.00||Tohoku Chemical Industries (Vietnam)., Ltd|Nhật Bản|2005-04-11 00:00:00|Cty TNHH Tohoku Chemical Industries (Việt Nam)|||
255|Sx các loại sơn dùng cho các sản phẩm làm bằng gỗ|0.00|377/GP-KCN-ĐN|061-3936021-061-936022|2005-04-21 00:00:00||KCN1|||50|2300000.00||Vietnam Washin Co., Ltd|Nhật Bản|2005-04-21 00:00:00|Cty TNHH Hóa chất Washin Việt Nam|||
256|Sx các loại ron cao su dùng cho cửa thang may và cửa lưới, sx đế giữ kiếng bằng cao su. Sx các loại ron dùng cho các loại cửa, pin và tấm năng lượng mặt trời. Sx linh kiện, chi tiết của thang máy, chi tiết của dụng cụ văn phòng phẩm. Thực hiện quyền xấut khẩu, nhập khẩu|0.00|384/GP-KCN-ĐN|061-3994782-0613-3994785|2005-04-29 00:00:00||KCN1|||50|1750000.00||Vina Melt Technos Co., Ltd|Nhật Bản|2005-04-29 00:00:00|Cty TNHH Vina Melt Technos|||
257|Sx các loại bao bì bằng nhựa (gồm: túi nhựa, hộp nhựa và màng phim nhựa)|0.00|399/GP-KCN-ĐN|-|2005-07-04 00:00:00||KCN1|||50|5000000.00||La Party Viet nam Co., Ltd|British Virgin Island|2005-07-04 00:00:00|Cty TNHH La Party Việt Nam|||
258|Sản xuất các loại băng keo. Thực hiện quyền xuất khẩu, quyền nhập khẩu|0.00|400/GP-KCN-ĐN|061-3994667/9-061-3994670|2005-07-04 00:00:00||KCN1|||50|3100000.00||UTC Vina Co., Ltd|Hàn Quốc|2005-07-04 00:00:00|Cty TNHH UTC Vina (trước là Union Tack Vina) (ngưng hoạt động)|||
259|Sản xuất các sản phẩm điện tử|0.00|402/GP-KCN-ĐN|061-3936801~03-061-3936800|2005-07-08 00:00:00||KCN1|||50|1695824.00||Spitfire Controls (Vietnam) Company Ltd|Cayman Islands|2005-07-08 00:00:00|Cty TNHH Spitfire Controls (Việt Nam)|||
260|Sx các loại thuốc bảo vệ thực vật và thuốc dệt côn trùng|0.00|405/GP-KCN-ĐN|061-3936458~459-061-936455|2005-07-26 00:00:00||KCN1|||50|5000000.00||Sundat Crop Science Co., Ltd|Singapore|2005-07-26 00:00:00|Cty TNHH Sundat Crop Science|||
261|Thiết kế, sản xuất dụng cụ dùng trong ngành thể thao, vui chơi, giải trí và thiết bị y tế|0.00|415/GP-KCN-ĐN|-|2005-08-22 00:00:00||KCN1|||50|3800000.00||Zoom (Vietnam) Co., Ltd|British Virgin Island|2005-08-22 00:00:00|Cty TNHH Zoom (Việt Nam) (Đang giải thể)|||
262|Sx các loại trang phục cưới, trang phục nghi lễ, Album ảnh đính kèm CD-ROM hoặc phim âm bản liên quan đến sản phẩm|0.00|422/GP-KCN-ĐN|061-3936058-061-936061|2005-09-21 00:00:00||KCN1|||50|5050000.00||Watabe Wedding Vietnam Co., Ltd|Nhật Bản|2005-09-21 00:00:00|Cty TNHH Watabe Wedding Việt Nam|||
263|Sx, gia công các loại khuôn mẫu chưa hoàn chỉnh bằng thép và sx các chi tiết khuôn mẫu bằng thép và kim loại. Dịch vụ xử lý nhiệt các sp bằng thép và các dịch vụ khác liên quan đến sx khuôn mẫu.|0.00|207/GP-KCN-ĐN|061-3936609-061-3936610|2003-03-20 00:00:00||KCN1|||50|8000000.00||Pro-Vision Special Steel J.S.C|Đài Loan|2003-03-20 00:00:00|Cty CP thép đặc biệt Pro-Vision|||
264|Sx các sản phẩm từ đá quý nhập khẩu|0.00|427/GP-KCN-ĐN|-|2005-10-26 00:00:00||KCN1|||50|1000000.00||GoldFine Manufactures (Vietnam) Co., Ltd|Thái Lan|2005-10-26 00:00:00|Cty TNHH GoldFine Manufactures (Việt Nam)|||
265|Sx đai dán, dây thun. Thực hiện quyền xuát khẩu, nhập khẩu.|0.00|429/GP-KCN-ĐN|061-3936440-542-061-3936441|2005-11-14 00:00:00||KCN1|||50|9000000.00||Lovetex Industrial Vietnam Co., Ltd|Đài Loan|2005-11-14 00:00:00|Cty TNHH Lovetex Industrial Việt Nam|||
266|Sx các loại sản phẩm và các chi tiết sản phẩm trang trí nội thất bằng gỗ từ nguồn gỗ nhập khẩu chính ngạch, gỗ MDF (Mediun density Fibreboard) và gỗ phủ PVC|0.00|446/GP-KCN-ĐN|061-3936426-061-3936428|2006-02-08 00:00:00||KCN1|||50|3300000.00||Livart Vina Co., Ltd|Hàn Quốc|2006-02-08 00:00:00|Cty TNHH Livart Vina|||
267|Sx các loại thuốc bảo vệ thực vật, thuốc trừ sâu, thuốc diệt cỏ và thuốc diệt nấm. Thực hiện quyền nhập khẩu.|0.00|457/GP-KCN-ĐN|061-3936380-061-3936381|2006-03-31 00:00:00||KCN1|||50|3058000.00||United Phosphorus VietNam Ltd|Mauritius|2006-03-31 00:00:00|Cty TNHH United Phosphorus Việt Nam|||
268|Sx các loại sản phẩm gỗ từ nguồn nguyên liệu nhập khẩu.|0.00|460/GP-KCN-ĐN|061-3936486-061-3836483|2006-04-21 00:00:00||KCN1|||50|8000000.00||Shirai VietNam Co, Ltd|Nhật Bản|2006-04-21 00:00:00|Cty TNHH Shirai Việt Nam (DN chế xuất)|||
269|Sx bột than, chổi than và các linh kiện, cụm linh kiện có liên quan. Sx các sp luyện kim bột các sản phẩm có liên quan, sx máy móc và công cụ để sx thỏi thanh. Thực hiện quyền xuất khẩu và nhập khẩu.|0.00|469/GP-KCN-ĐN|061-3936614-|2006-05-26 00:00:00||KCN1|||50|4257100.00||Fuji Carbon (VietNam) Co., Ltd|Nhật Bản|2006-05-26 00:00:00|Cty TNHH Fuji Carbon Việt Nam|||
270|Sx đồ nội thất và các chi tiết, phụ kiện đồ nội thất bằng gỗ|0.00|478/GP-KCN-ĐN|061-3936288-061-3936290|2006-06-20 00:00:00||KCN1|||50|4681490.00||Whittier Wood Products (VietNam) Co., Ltd|Mỹ|2006-06-20 00:00:00|Cty TNHH Whittier Wood Products (Việt Nam)|||
294|Sx các bộ phận điện tử và linh kiện điện tử|0.00|472043000401|-|2008-02-13 00:00:00||KCN1|||50|13590000.00||Hosiden VietNam Co., LTD|Nhật Bản|2008-02-13 00:00:00|Cty TNHH Hosiden Việt Nam|||
271|Sx gia công, pha chế các sản phẩm tiêu dùng bao gồm: mỹ phẩm, sp vệ sinh gia dụng và thực phẩm chức năng, thực hiện các dịch vụ lưu kho, quản lý hàng lưu kho, và hỗ trợ thanh toán cho khách hàng tiêu thụ sp của Công ty.Thực hiện quyền xuất khẩu và nhập khẩu; sx mỹ phẩm từ bán thành phẩm|0.00|482/GP-KCN-ĐN|061-3890800-061-3936575|2006-06-28 00:00:00||KCN1|||50|14848000.00||Amway VietNam Co., Ltd |Mỹ|2006-06-28 00:00:00|Cty TNHH Amway Việt Nam|||
272|Sx các bộ phận của máy và xe chuyên dùng trong ngành Công nghiệp và xây dựng. SX chương trình phần mềm cho các loại máy cắt, sx các bộ phận của máy và xe chuyên dụng dùng trong ngành nông nghiệp, giao thông vận tải, cầu đường; sx và gia công các chủng loại linh kiện khác dùng trong ngành công nghiệp, xây dựng, nông nghiệp và giao thông vận tải, cầu đường,...Thực hiện quyền xuất khẩu, nhập khẩu.|0.00|483/GP-KCN-ĐN|061-3936652/3-061-3936654|2006-06-28 00:00:00||KCN1|||50|10020000.00||KMV (VietNam) Co., Ltd|Nhật Bản|2006-06-28 00:00:00|Cty TNHH KMV (Việt Nam)|||
273|Gia công thép và các sản phẩm kim loại màu. Thực hiện quyền xuất khẩu, nhập khẩu.|0.00|484/GP-KCN-ĐN|061-3936461-464-061-3936465|2006-06-28 00:00:00||KCN1|||50|13000000.00||JFE Shoji Steel Vietnam., Co Ltd|Nhật Bản|2006-06-28 00:00:00|Cty TNHH Thép JFE Shoji Việt Nam|||
274|Sx các loại sơn dùng cho tàu biển và chất phủ bảo vệ bề mặt|0.00|485/GP-KCN-ĐN|061-3936123-061-3936124|2006-06-30 00:00:00||KCN1|||50|1300000.00||PPG Yung Chi Coatings Company Ltd|Hà Lan-Đài Loan|2006-06-30 00:00:00|Cty TNHH PPG Yung Chi Coatings Company Limited|||
275|Sx chất phụ gia, chế phẩm sinh học dùng để chế biến thức ăn cho gia súc, thức ăn cho gia cầm và thức ăn thủy sản. Thực hiện các dịch vụ hỗ trợ việc tiêu thụ sản phẩm do doanh nghiệp sx. Thực hiện quyền nhập khẩu và quyền phân phối|0.00|486/GP-KCN-ĐN|061-3936521-061-3936530|2006-06-30 00:00:00||KCN1|||50|300000.00||Alltech VietNam Company Limited|Mỹ|2006-06-30 00:00:00|Cty TNHH Alltech Việt Nam|||
276|Thiết kế và sx các sản phẩm may mặc|0.00|472023000018|061-3936550-061-3936551|2006-11-20 00:00:00||KCN1|||50|10000000.00||Ecosoft (Vietnam) Co., Ltd|Mỹ- British Virgin Islands|2006-11-20 00:00:00|Cty TNHH Ecosoft (Việt Nam)|||
277|Sx hàng may mặc. Thực hiện quyền xuất khẩu, nhập khẩu.|0.00|472043000021|061-3936496-061-3936498|2006-11-21 00:00:00||KCN1|||50|810000.00||Vietnam Takagi Co., Ltd|Nhật Bản|2006-11-21 00:00:00|Cty TNHH Việt Nam Takagi|||
278|Sx, gia công các linh kiện điện tử cố định và các linh kiện cảm ứng nhiệt|0.00|472043000033|061-3936416-061-3936417|2006-12-14 00:00:00||KCN1|||50|300000.00||Sensor Scientific Vietnam Co., Ltd|Mỹ|2006-12-14 00:00:00|Cty TNHH Sensor Scientific Việt Nam|||
279|Sx plastic và cao su tổng hợp. Thực hiện quyền xuất khẩu, nhập khẩu.|0.00|472043000048|061-3936580-061-3936584|2006-12-29 00:00:00||KCN1|||50|7000000.00||Dongsung Chemical (Vietnam) Co., Ltd|Hàn Quốc|2006-12-29 00:00:00|Cty TNHH Dongsung Chemical (Việt Nam)|||
