id|business_domain|chartered_capital|license|contact_address|date_of_licence|description|implement_address|implement_comments|implement_due_date|implement_duration|investment_capital|invesment_model|investor|investor_country|issue_date|name|parent_id|visible|activated
563|Sx các loại quạt tản nhiệt, môtơ truyền động dùng cho xe ôtô và máy công nghiệp. SX các loại phụ tùng xe ô tô. Sx linh kiện và bán thành phẩm của quạt tản nhiệt, mô tơ truyền động dùng cho xe ô tô và máy công nghiệp.|0.00|209/GP-KCN-ĐN|061-3993002/003-061-993005|2003-04-09 00:00:00||KCN6|||50|11000000.00||DongJin Vietnam Co., Ltd|Hàn Quốc|2003-04-09 00:00:00|Cty TNHH DongJin Việt Nam|||
564|Sx tấm đáy bằng nhôm của nồi chảo inox, sx các loại hộp đựng bút, hộp đựng văn phòng phẩm bằng kim loại, sx các loại xốp cách nhiệt và bình giữ lạnh|0.00|212/GP-KCN-ĐN|061-3993851/206-061-935890|2003-04-22 00:00:00||KCN6|||50|1400000.00||Han Pack Co., Ltd|Hàn Quốc|2003-04-22 00:00:00|Cty TNHH Han Pack (trước là Dae gil) (tạm ngừng hđ 01 năm)|||
565|Sx sản phẩm may mặc|0.00|215/GP-KCN-ĐN|061-893500-061-893502|2003-05-12 00:00:00||KCN6|||50|1880714.00||Vien Modewin Co., Ltd|Hàn Quốc|2003-05-12 00:00:00|Cty TNHH Vien Modewin (đang giải thể)|||
566|Sx giấy luạ tráng nhôm, sx băng P/S, cắt sản phẩm màng nhôm, sx băng nhôm và băng thép, dập lưỡi răng cưa sự dụng cho hộp bao bì. Thực hiện quyền xuất khẩu, quyền nhập khẩu|0.00|226/GP-KCN-ĐN| 061-3992996/997-061-992998|2003-07-18 00:00:00||KCN6|||50|1458690.00||SM Alupack Co., Ltd|Hàn Quốc|2003-07-18 00:00:00|Cty TNHH SM Alupack|||
567|Dệt vải|0.00|229/GP-KCN-ĐN|061-3993274-|2003-08-05 00:00:00||KCN6|||50|507400.00||Kaya Vina Co., Ltd|Hàn Quốc|2003-08-05 00:00:00|Cty TNHH Kaya Vina|||
568|Sản xuất mực in các loại và keo sử dụng cho ngành sản xuất mực in. Sx các chất dùng để phủ nền nhà và nền nhà xưởng. Sx các loại hạt màu và các loại dung môi; thực hiện quyền xuất khẩu và nhập khẩu|0.00|239/GP-KCN-ĐN|061-3993336-061-3993339|2003-10-06 00:00:00||KCN6|||50|2350000.00||D.Y Vina Chemical Co., Ltd|Hàn Quốc|2003-10-06 00:00:00|Cty TNHH Hóa chất Dy Vina|||
569|Sản xuất các loại túi xách bằng nylon, polyester, da PU, da P.V.C, Sản xuất các loại túi xách bằng nylon, polyester, da PU, da P.V.C, Sản xuất các loại tấm nệm, tấm lót, tấm màn che phủ bằng vải nylon, polyester, da P.U, da P.V.C. Tthực hiện quyền xuất khẩu và nhập khẩu|0.00|249/GP-KCN-ĐN|061-3993340/5-061-993348|2003-11-27 00:00:00||KCN6|||50|3000000.00||Dong Jin Leiports Vina Co., Ltd|Hàn Quốc|2003-11-27 00:00:00|Cty TNHH Dong Jin Leiports Vina|||
905|Sx, gia công các sản phẩm dệt may|0.00|77|061-3514190/91/92-061-3514189|2006-12-28 00:00:00||KCN14|||50|1000000.00||Apex Vietnam Co., Ltd|Pháp|2006-12-28 00:00:00|Cty TNHH Apex Việt Nam|||
571|Sx các loại motor dùng trong công nghiệp, sx các loại khóa kéo, dây đai, khóa dây thắt lưng…|0.00|263/GP-KCN-ĐN|-|2004-01-07 00:00:00||KCN6|||50|2025000.00||Hy Vina Co., Ltd|Hàn Quốc|2004-01-07 00:00:00|Cty TNHH Hy Vina|||
572|Sx keo acrylic các loại, Album (không chứa thông tin, hình ảnh), sx hộp đựng điện thoại di động bằng giấy phủ plastic; sx chất hoạt động bề mặt dùng trong ngành dệt, in ấn; chất kết gắn binder dùng cho xây dựng và chất kết dính urethane (không sx hóa học cơ bản); thực hiện quyền xuất khẩu, quyền nhập khẩu và quyền phân phối.|0.00|270/GP-KCN-ĐN|061-3993368-|2004-02-25 00:00:00||KCN6|||50|2505540.00||Shinhan Vina Co., Ltd|Hàn Quốc|2004-02-25 00:00:00|Cty TNHH Shinhan Vina|||
573|Sx khuôn mẫu và các sản phẩm từ khuôn mẫu bằng kim loại. SX sản phẩm hộp đèn trang trí. Thực hiện quyền xuất khẩu, nhập khẩu.|0.00|280/GP-KCN-ĐN|061-3993575-061-993576|2004-04-19 00:00:00||KCN6|||50|1500000.00||TTD, INC Vietnam|Mỹ|2004-04-19 00:00:00|Cty TNHH TTD, INC. Việt Nam|||
574|Sx và lắp ráp máy hóa hơi, máy chiết nạp ga & các thiết bị có liên quan|0.00|287/GP-KCN-ĐN|-|2004-05-05 00:00:00||KCN6|||50|600000.00||Samjin Vina Co., Ltd|Hàn Quốc|2004-05-05 00:00:00|Cty TNHH SamJin Vina|||
575|Sx thức ăn cho gia súc, gia cầm & thức ăn nuôi trồng thủy sản|0.00|288/GP-KCN-ĐN|061-3993588-061-993590|2004-05-05 00:00:00||KCN6|||50|1400000.00||Gold Coin Feedmill (Dong Nai) Co., Ltd|British Virgin Island|2004-05-05 00:00:00|Cty TNHH Gold Coin Feedmill Đồng Nai (tên cũ là Cty TNHH Thức ăn chăn nuôi Kim Tiền Đồng Nai)|||
576|SX các SP bằng kim loại dùng trong gia dụng và công nghiệp, SX các SP bằng nhựa dùng trong gia dụng và công nghiệp, xử lý và tráng phủ bề mặt kim loại, các công việc xử lý cơ học thông thường trên cơ sở nhận gia công (k bao gồm công đoạn xi mạ)|0.00|292/GP-KCN-ĐN|061-3992549-061-3993694|2004-05-24 00:00:00||KCN6|||50|2100000.00||Platech Co., Ltd|Hàn Quốc|2004-05-24 00:00:00|Cty TNHH Platech|||
577|Sx các loại sơn và dung môi dùng trong ngành dân dụng và công nghiệp. Thực hiện dịch vụ phun sơn các loại sp dùng trong ngành công nghiệp. Thực hiện quyền xuất khẩu, nhập khẩu.|0.00|299/GP-KCN-ĐN|061-3994164-8-061-994163|2004-06-25 00:00:00||KCN6|||50|2400000.00||Vietnam WeiZheng Industry Company Limited |Brunei|2004-06-25 00:00:00|Cty TNHH CN Việt Nam Uy Tín|||
578|Sx ván ép MFC (Melamine Faced Chipboard)|0.00|302/GP-KCN-ĐN|061-3993436/35-061-993437|2004-07-02 00:00:00||KCN6|||50|1250000.00||Fine Decor Co., Ltd|Hàn Quốc|2004-07-02 00:00:00|Cty TNHH Fine Decor|||
579|Sx, gia công các loại bu-lông, tán, loong đền, đinh, vít, ngũ kim; các loại linh kiện bằng thép của xe mô tô, ôtô và của các sản phẩm điện gia dụng|0.00|203/GP-KCN-ĐN|061-3993888-061-993908|2004-08-30 00:00:00||KCN6|||50|2800000.00||Chienta Industrial Co., Ltd|Đài Loan|2004-08-30 00:00:00|Cty TNHH Công nghiệp Kiến Đạt|||
580|Sx các loại khuôn mẫu bằng kim loại|0.00|321/GP-KCN-ĐN|061-3993690/89-061-3993691|2004-09-28 00:00:00||KCN6|||50|1200000.00||Hitech Mould Co., Ltd|Hàn Quốc|2004-09-28 00:00:00|Cty TNHH Hitech Mould|||
581|Chế biến thực phẩm từ gia cầm, gia suc và ngũ cốc, sx các suất ăn chế biến sẵn. Sx thức ăn nhanh|0.00|325/GP-KCN-ĐN|061-3994780-|2004-10-12 00:00:00||KCN6|||50|6500000.00||Unitek Enterprise PTY Ltd|Trung Quốc (Hong Kong)|2004-10-12 00:00:00|Cty TNHH Unitek Enterprise|||
582|Sx các loại nến|0.00|358/GP-KCN-ĐN|061-3994198-|2005-02-17 00:00:00||KCN6|||50|2000000.00||Peaktop (Vietnam) Limited|Đài Loan|2005-02-17 00:00:00|Cty TNHH Peaktop (Việt Nam)|||
583|Sx, chế biến và bảo quản thịt, thủy sản, rau quả, dầu mỡ động thực vật (thực phẩm từ rong biển, từ nông sản và từ thủy sản); sx cacao, sôcola và mứt, kẹo (các loại bánh kẹo). Thực hiện quyền xuất khẩu, nhập khẩu|0.00|359/GP-KCN-ĐN|08-38980450-|2005-03-02 00:00:00||KCN6|||50|250000.00||Green World Co., Ltd|Hàn Quốc|2005-03-02 00:00:00|Cty TNHH Green World|||
584|Sx các loại mũ vải; Thực hiện quyền xuất khẩu, nhập khẩu|0.00|363/GP-KCN-ĐN|061. 3291769-061-291766|2005-03-11 00:00:00||KCN6|||50|3000000.00||Movina Co., Ltd|Republic of Dominica|2005-03-11 00:00:00|Cty TNHH Movina|||
585|Sx thành phẩm và bán thành phẩm của giầy thể thao|0.00|374/GP-KCN-ĐN|061-3892985-061-892986|2005-04-11 00:00:00||KCN6|||50|6800000.00||Taekwang MTC Vina Co., Ltd|Hàn Quốc|2005-04-11 00:00:00|Cty TNHH Tae Kwang MTC Việt Nam (trước đây là BS tech)|||
586|Sx các loại linh kiện xe ô tô, xe gắn máy. Sx và gia công các loại linh kiện, phụ tùng bằng kim loại dùng trong điện gia dụng, dụng cụ thể thao, ngành y tế, lĩnh vực cơ khí|0.00|216/GPĐC4-BD-KCN-ĐN|061-3291816/818-061-3291820|2005-06-03 00:00:00||KCN6|||50|5000000.00||Vietnam Three Brothers Machnery Industrial Co., Ltd|Đài Loan|2005-06-03 00:00:00|Cty TNHH CN Three Brother (VN) (trước đây là Tam Thân)|||
587|Sx các loại dụng cụ bàn ăn (dao, muỗng, nĩa các loại), sx các loại bao bì và lơ đánh bóng|0.00|397/GP-KCN-ĐN|061-3994529/30-061-3994531|2005-06-21 00:00:00||KCN6|||50|15000000.00||Seorim Vietnam Co., Ltd|Hàn Quốc|2005-06-21 00:00:00|Cty TNHH Seorim|||
588|Lắp ráp và sản xuất xe tải đa dụng loại nhỏ, xe chở khách loại nhỏ, xe máy nhãn hiệu Suzuki,sx các loại linh kiện phụ tùng cho xe ô tô và xe máy, cung cấp các dịch vụ bảo hành, sửa xe ô tô và xe máy Suzuki. Thực hiện quyền xuất khẩu, nhập khẩu.|0.00|1212/GP|061-3838707-061-3838706|1995-04-21 00:00:00||KCN6|||50|109500000.00||VISUCO|Việt Nam- Nhật Bản|1995-04-21 00:00:00|Cty TNHH Việt Nam Suzuki|||
589|Sx Formalin 37%.,Sx Formalin từ 37% đến 50%. Thực hiện quyền xuất khẩu và nhập khẩu.|0.00|406/GP-KCN-ĐN|061-3293478/9-061-3293479|2005-07-26 00:00:00||KCN6|||50|26950000.00||Green Chemical Co., Ltd|Hàn Quốc|2005-07-26 00:00:00|Cty TNHH Green Chemical|||
590|Sx các loại nến và các sản phẩm liên quan|0.00|421/GP-KCN-ĐN|061-3291700-061-291702|2005-09-21 00:00:00||KCN6|||50|1030000.00||Eastgate Limited Liability Company|Mỹ|2005-09-21 00:00:00|Cty TNHH Đông Quan (trước là Lava Land)|||
591|Sx linh kiện, phụ tùng xe ô tô. Thực hiện quyền nhập khẩu|0.00|442/GP-KCN-ĐN|061-3993002-|2006-01-25 00:00:00||KCN6|||50|500000.00||Dongjin Vietnam Industrial Co., Ltd|Hàn Quốc|2006-01-25 00:00:00|Cty TNHH CN Dong Jin Việt Nam (thuê nhà xưởng Cty TNHH DONGJIN VN)|||
592|Sx các sản phẩm cao su dùng cho công nghiệp sản xuất xe ô tô|0.00|443/GP-KCN-ĐN|061-3995390-061-3995391|2006-01-25 00:00:00||KCN6|||50|1100000.00||Daechang Rubber (VN) Co., Ltd|Hàn Quốc|2006-01-25 00:00:00|Cty TNHH Daechang Rubber (VN)|||
593|Sx bảng mạch điện tử FPC (Flexible print circuit)|0.00|458/GP-KCN-ĐN|061-8890001-061-8890004|2006-04-03 00:00:00||KCN6|||50|12500000.00||Sakai Circuit Device of Vietnam Co., Ltd|Nhật Bản|2006-04-03 00:00:00|Cty TNHH Sakai Circuit Device Việt Nam|||
594|Dệt, thêu và in trên các sản phẩm may mặc|0.00|459/GP-KCN-ĐN|061-3995678-061-3995681|2006-04-20 00:00:00||KCN6|||50|4000000.00||Fu Lien Co., Ltd|Đài Loan|2006-04-20 00:00:00|Cty TNHH Fu Lien|||
595|Sx các sản phẩm may mặc|0.00|471/GP-KCN-ĐN|061-3892970/972-061-3291829|2006-05-31 00:00:00||KCN6|||50|3320000.00||Vega Fashion Co., Ltd|Đài Loan|2006-05-31 00:00:00|Cty TNHH Vega Fashion (sáp nhập Bride & Co) (DN chế xuất)|||
596|Sx bao nilon, lơ đánh bóng kim loại, bánh xe đánh bóng kim loại|0.00|472033000267|061-6291791-061-6391778|2007-10-18 00:00:00||KCN6|||50|310000.00||Samboo Co., LTD|Hàn Quốc|2007-10-18 00:00:00|Cty TNHH Samboo|||
597|Sx các loại linh kiện, phụ tùng cho xe ô tô, xe gắn máy. Sx các loại chảo tay và ép nhựa plastic|0.00|382/GP-KCN-ĐN|061-8890630-061-8890629|2005-04-29 00:00:00||KCN6|||50|800000.00||Boram Forging Co., Ltd|Hàn Quốc|2005-04-29 00:00:00|Cty TNHH Boram Forging (trước ở KCN An Phước)|||
598|SX các loại tấm trang trí nội thất, ngoại thất, sx các chi tiết, phụ tùng, linh kiện xe gắn máy và xe hơi (thắng đĩa, khung, sườn xe gắn máy và xe hơi), sx các loại khung kim loại (khung trần nổi, khung trần chìm, khung vách ngan) và các sản phẩm thép sẻ khổ; sx các thiết bị điện tử; sx, chế tạo thiết bị cơ khí chính xác. Cho thuê nhà xưởng|0.00|472023000527|-|2008-06-26 00:00:00||KCN6|||50|3000000.00||Raysound Industrial Co., LTD|Đài Loan-Việt Nam|2008-06-26 00:00:00|Cty TNHH Solar Rich (tên cũ là Cty TNHH Công nghiệp Raysound)|||
599|Sx, lắp ráp thiết bị lọc nước|0.00|219/GP-KCN-ĐN|061-3836729-061-836626|2003-06-02 00:00:00||KCN6|||50|1100000.00||Chessi Co., Ltd|Hàn Quốc|2003-06-02 00:00:00|Cty TNHH Chessi (trước là ALPS) (thuê nhà xưởng Cty Happy Cook 01 năm kể từ ngày 18/3/2008)|||
600|Sx các loại hóa chất và chất phụ gia dạng thể lỏng, nén viên, bột dùng trong công nghiệp chế biến thực phẫm và công nghiệp sản xuất mỹ phẩm|0.00|472023000704|-|2008-11-07 00:00:00||KCN6|||50|10000000.00|||Nhật Bản|2008-11-07 00:00:00|Cty TNHH Aureole Fine Chemical Products (DN Chế xuất)|||
601|Sx các loại bơm có kích thước nhỏ dùng cho các thiết bị y tế, máy in và các thiết bị khác.|0.00|472043000723|-|2008-12-24 00:00:00||KCN6|||50|1500000.00|||Nhật Bản|2008-12-24 00:00:00|Cty TNHH Oken Seiko Việt Nam|||
602|Sx vải thành phẩm (không bao gồm công đoạn nhuộm)|0.00|472043000739|-|2009-06-18 00:00:00||KCN6|||50|8000000.00|||Hàn Quốc|2009-06-18 00:00:00|Cty TNHH Young Jin Textile Việt Nam (thuê nhà xưởng của Cty Loteco)|||
603|Sx các chất phụ gia sử dụng trong xây dựng, thực hiện dịch vụ tư vấn kỹ thuật, hoạt động hỗ trợ các thiết bị, dụng cụ, dịch vụ lưu kho, hỗ trợ giao hàng, quản lý hàng tồn kho, thực hiện quyền nhập khẩu. Thực hiện quyền phân phối.|0.00|758/GP|061-3560700-061-3560699|1993-12-31 00:00:00||KCN7|||50|6650000.00||Sika Limited (Vietnam)|Thụy Sĩ|1993-12-31 00:00:00|Cty Sika hữu hạn Việt Nam|||
604|Sx các sp sợi và vải|0.00|1009/GP|061-3560500-010-061-3560510|1994-10-12 00:00:00||KCN7|||50|51637829.00||TongKook Vietnam Spinning Co., Ltd|Hàn Quốc|1994-10-12 00:00:00|Cty TNHH Tongkook Việt Nam Spinning|||
605|Chế tạo lắp ráp các kết cấu, cột tháp, thùng chứa và bể chứa bằng thép, tham gia thầu xây lắp các công trình dân dụng và công nghiệp có liên quan tới việc cung cấp sản phẩm do cty sx tại VN. Tham gia thi công các công trình dân dụng và công nghiệp khác.|0.00|1243/GP|061-3848716/633-061-3848634|1995-05-23 00:00:00||KCN7|||50|26800000.00||Poslilama Engineering & Construction Co., Ltd|VN-Hàn Quốc|1995-05-23 00:00:00|Cty cơ khí và xây dựng Posco E&C Lilama (tên cũ là Cty Cơ khí và xây dựng Poslilama)|||
606|Sx thiết bị vệ sinh cao cấp bằng sứ, sx bồn tắm, vòi nước và phụ kiện bằng kim loại dùng cho phòng tắm và các thiết bị vệ sinh, xử lý xi mạ sp trong dây chuyền sx vòi nước bằng đồng do cty sx. Thực hiện quyền xuất khẩu, nhập khẩu.|0.00|1516/GP|061-3569090-061-3569191|1996-03-20 00:00:00||KCN7|||50|17000000.00||Vietnam Caesar Sanitary Wares Joint Stock Company|Đài Loan|1996-03-20 00:00:00|Cty CP Thiết bị vệ sinh Caesar Việt Nam|||
607|Sx giày dép da mũ giày và phụ kiện giày|0.00|1649/GP|061-3560961/68-061-3848569|1996-08-14 00:00:00||KCN7|||50|6000000.00||Speco|Đài Loan|1996-08-14 00:00:00|Cty  Splendour TNHH|||
608|Thiết kế, chế tạo, lắp đặt hệ thống bồn chứa hóa chất, hóa dầu, đường ống và các thiết bị có liên quan…|0.00|1897/GP|08-4101300-08-4101297|1997-05-12 00:00:00||KCN7|||50|2000000.00||Hai Leck (VN) Engineering Co., Ltd|Singapore|1997-05-12 00:00:00|Cty Kỹ nghệ Haileck|||
609|Sx khuôn mẫu kim loại và một số loại chi tiết cơ khí dùng để lắp ráp linh kiện điện, điện tử, phụ tùng ôtô, xe máy|0.00|6/GP-KCN-ĐN|061-3560687/686-061-3560685|1997-09-15 00:00:00||KCN7|||50|7000000.00||Hirota Precision Vietnam Co., Ltd|Nhật Bản|1997-09-15 00:00:00|Cty TNHH Hirota Precision Việt Nam|||
610|Sx các loại lều, bạt, túi ngủ, ba lô, sx các loại bàn, ghế, cọc lều và đồ gia dụng ngoài trời từ nguồn gỗ được nhà nước cho phép sử dụng.|0.00|22/GP-KCN-ĐN|061-3560615-061-3560616|1998-09-03 00:00:00||KCN7|||50|920000.00||Loong Bien Vietnam Co., Ltd|Đài Loan|1998-09-03 00:00:00|Cty TNHH Loong Biên Việt Nam|||
611|Sx linh kiện và phụ tùng xe đạp, sx và lắp ráp hoàn chỉnh xe đạp (gồm xe 2 và 3 bánh), xe đạp điện (gồm loại có bàn đạp và k có bàn đạp) và xe đạp có gắn động cơ, sx trụ căng phông màn và dụng cụ làm vườn bằng kim lo|0.00|33/GP-KCN-ĐN|061-3560625/626-061-3560627|1999-08-30 00:00:00||KCN7|||50|11810000.00||Dragon Bicycles Vietnam Co., Ltd|British Virgin Islands|1999-08-30 00:00:00|Cty Xe đạp Con Rồng Việt Nam TNHH (NGƯNG HOẠT ĐỘNG)|||
612|Kéo sợi, dệt, nhuộm vải|0.00|41/GP-KCN-ĐN|061 - 3560606/608-061-3560609|2000-04-10 00:00:00||KCN7|||50|18000000.00||Lien Minh Vina Co., Ltd|Đài Loan|2000-04-10 00:00:00|Cty TNHH Liên minh Vina (ngưng hoạt động)|||
613|Sx đồ dùng trong nhà, dụng cụ y tế, thể thao bằng kim loại|0.00|49/GP-KCN-ĐN|061-3549528/537/3560131-061-3549535|2000-07-19 00:00:00||KCN7|||50|5000000.00||Vietnam Sun Chun Industrial Co., Ltd|Đài Loan|2000-07-19 00:00:00|Cty TNHH Công nghiệp Thăng Xuyên Việt Nam|||
614|Sx các loại gạch men và gạch mỹ thuật trang trí chất lượng cao, xây dựng công trình dân dụng.|0.00|52/GP-KCN-ĐN|061-3560770/776-061-3560778|2000-09-01 00:00:00||KCN7|||50|15000000.00||Chang Yih Ceramic Joint Stock Company|Đài Loan|2000-09-01 00:00:00|Cty Cổ phần Gạch men Chang Yih|||
615|Nhuộm vải|0.00|54/GP-KCN-ĐN|061-3549591-594-061-3549590|2000-09-22 00:00:00||KCN7|||50|2300000.00||Il Kwang Vina Co., Ltd|Hàn Quốc|2000-09-22 00:00:00|Cty TNHH IL Kwang Vina|||
616|Sx các loại đèn chiếu sáng, trang trí và chiếu hình; sx các linh kiện thiết bị điện, tư vấn thiết kế hệ thống điện dân dụng và công nghiệp; Thực hiện quyền xuất khẩu, quyền nhập khẩu và quyền phân phối.|0.00|66/GP-KCN-ĐN|061-3560859-061-3560858|2001-01-02 00:00:00||KCN7|||50|50000000.00||Wooree Vina Co., Ltd|Hàn Quốc|2001-01-02 00:00:00|Cty TNHH Wooree Vina|||
617|Sx, gia công các loại ống giấy phục vụ ngành sợi và dệt|0.00|75/GP-KCN-ĐN|061-3560898-061-3560900|2001-02-20 00:00:00||KCN7|||50|970000.00||Tair Dar Co., Ltd|Đài Loan|2001-02-20 00:00:00|Cty TNHH Đài Đạt|||
618|Sx các sản phẩm may mặc|0.00|78/GP-KCN-ĐN|061-3560706-708-061-3560709|2001-04-23 00:00:00||KCN7|||50|3000000.00||United Sweethearts Garment (Vietnam) Co., Ltd|Malaixia|2001-04-23 00:00:00|Cty TNHH may mặc United Sweethearts Việt Nam|||
619|Sx phụ kiện bằng nhựa dùng cho thiết bị vệ sinh|0.00|81/GP-KCN-ĐN|061-3569158-159-061-3569160|2001-05-29 00:00:00||KCN7|||50|1500000.00||Chung Long Plastic Industrial (Vietnam) Co., Ltd|Đài Loan|2001-05-29 00:00:00|Cty TNHH Nhựa Công nghiệp Chung Long Việt Nam|||
620|Sx nguyên liệu gạch men|0.00|84/GP-KCN-ĐN|061-3560803-061-3549803|2001-08-01 00:00:00||KCN7|||50|1000000.00||Xie Xing Ceramic Industries Co., Ltd|Đài Loan|2001-08-01 00:00:00|Cty TNHH Công nghiệp Gốm sứ Xie Xing (trước là Ho Yeh)|||
621|Sx các loại bột sơn tĩnh điện|0.00|90/GP-KCN-ĐN|061-3560730-061-3560740|2002-08-22 00:00:00||KCN7|||50|4000000.00||Akzo Nobel Chang Cheng (Viet Nam) Limited|Đài Loan|2002-08-22 00:00:00|Cty TNHH Akzo Nobel Chang Cheng (Việt Nam)|||
622|Sx, chế biến da và các sản phẩm từ da, sx chế biến da nhân tạo và các sp từ da nhân tạo.|0.00|98/GP-KCN-ĐN|061-3560494-061-3560824|2001-11-08 00:00:00||KCN7|||50|30000000.00||Samwoo Vietnam Co., Ltd|Hàn Quốc|2001-11-08 00:00:00|Cty TNHH Samwoo Việt Nam|||
623|Sx các loại dây thun và nguyên liệu cao cấp để sx quần áo XK . SX phụ liệu cho ngành dệt, các sp sợi, chỉ thun.|0.00|110/GP-KCN-ĐN|061-3560832/3/4-061-3560835|2002-01-23 00:00:00||KCN7|||50|4000000.00||Premier Elastic Webbing & Accessories (Vietnam) Co., Ltd|Malaixia|2002-01-23 00:00:00|Cty TNHH sản xuất thun và nguyên liệu may Premier (Việt Nam)|||
624|Sx thép thanh, thép dây không gỉ các loại, thép dây carbon các loại, thép dây hợp kim các loại|0.00|111/GP-KCN-ĐN|061-3560812-061-3560811|2002-01-29 00:00:00||KCN7|||50|20000000.00||Dong Bang Stainless Steel Co., Ltd|Hàn Quốc|2002-01-29 00:00:00|Cty TNHH Thép Dongbang|||
625|Sx các loại túi xách và vali ; cho thuê nhà xưởng dôi dư.|0.00|112/GP-KCN-ĐN|061-549868/869/870-061-549714|2002-01-31 00:00:00||KCN7|||50|4000000.00||High Point Vietnam Co., Ltd|Panama|2002-01-31 00:00:00|Cty TNHH High Point Việt Nam (ngưng hoạt động)|||
626|Sx bình chứa khí, gia công lắp ráp máy nén khí và hệ thống cung cấp khí nén, cung cấp các dịch vụ sửa chữa, bảo trì các sp nêu trên|0.00|118/GP-KCN-ĐN|061-3560045/46/47/48-061-3560049|2002-03-14 00:00:00||KCN7|||50|800000.00||Swan Industry (Viet nam) Co., Ltd|Mỹ|2002-03-14 00:00:00|Cty TNHH Công nghiệp Swan Việt Nam|||
627|Sx nhuộm sợi các loại, dệt, nhuộm và hoàn tất các loại vải cao cấp|0.00|119/GP-KCN-ĐN|061-3560075-077-061-3848832/833090|2002-03-15 00:00:00||KCN7|||50|28600000.00||Daewon Textile Vietnam Co., Ltd|Hàn Quốc|2002-03-15 00:00:00|Cty TNHH Dệt Daewon Việt Nam|||
628|Sx giày thể thao và các bộ phận của giầy|0.00|123/GP-KCN-ĐN|061-3560800/01/02-061-3549804|2002-04-02 00:00:00||KCN7|||50|70000000.00||Hwaseung Vina Co., Ltd|Hàn Quốc|2002-04-02 00:00:00|Cty TNHH Hwaseung Vina|||
629|Sx các loại lều xếp, khung lều và các phụ kiện đi kèm. SX bàn ghế sofa bằng gỗ (từ nguồn gỗ nhập khẩu chính ngạch) và bằng da (đã qua sơ chế và nhập khẩu)|0.00|143/GP-KCN-ĐN|061-3560190/412-061 - 3549719|2002-07-25 00:00:00||KCN7|||50|1000000.00||Seo Incheon Vietnam Co., Ltd|Hàn Quốc|2002-07-25 00:00:00|Cty TNHH Seo Incheon Việt Nam (cũ là Cty TNHH Bu Kyeong VN)|||
630|Sx các loại dụng cụ ăn, nấu ăn, đồ dùng gia đình bằng kim loại. SX phụ kiện cho ngành giày dép và may mặc. Cho thuê nhà xưởng|0.00|144/GP-KCN-ĐN|061-3560873-061-3560872|2002-07-25 00:00:00||KCN7|||50|2800000.00||Shih Jung Vietnam Co., Ltd|Brunei|2002-07-25 00:00:00|Cty TNHH Shih Jung Việt Nam|||
631|Sx, gia công các loại đồ gỗ văn phòng, gia dụng từ nguồn gỗ nhập khẩu chính ngạch và gỗ trồng rừng. Thực hiện quyền xuất khẩu, nhập khẩu.|0.00|158/GP-KCN-ĐN|061-3560839-061-3560838|2002-09-30 00:00:00||KCN7|||50|3900000.00||Yue Hsin (Vietnam) Woodwork Co., Ltd|Đài Loan|2002-09-30 00:00:00|Cty TNHH Việt Tín (Việt Nam)|||
632|Sx kẽm cuộn, các sản phẩm từ sợi kẽm. Sx Sp gia dụng và dụng cụ thể thao từ nguồn nguyên liệu nhập khẩu. Thực hiện quyền xuất khẩu, nhập khẩu.|0.00|168/GP-KCN-ĐN|061-3540131/132/3560238-061-3540133|2002-10-31 00:00:00||KCN7|||50|1000000.00||Run Tai Stock Co., Ltd|Đài Loan|2002-10-31 00:00:00|Cty TNHH Nhuận Thái|||
633|Sx dây kẽm, dây thép, dây thép không gỉ, dây thép mạ và các loại đinh, kim thép|0.00|180/GP-KCN-ĐN|061-3540125/128/3560104-061-3540129|2002-12-02 00:00:00||KCN7|||50|1573000.00||Lee Bao Steel and Iron Co., Ltd|Đài Loan|2002-12-02 00:00:00|Cty TNHH Cổ phần Sắt thép Lực Bảo|||
634|Sx, gia công & lắp ráp thành phẩm, bán thành phẩm: mô tơ, các loại quạt điện, linh kiện điện tử, linh kiện nhụa, kim loại và dụng cụ thể thao; sx các sản phẩm từ sợi kim loại; sx, gia công các sản phẩm từ ống kim loại; sx và lắp đặt các loại hệ thống trang thiết bị kho bãi chứa hàng hóa vật tư; thực hiện quyền xuất khẩu, quyền nhập khẩu; sx gia công lắp ráp các sản phẩm từ sắt thép dùng trong công nghiệp và dân dụng, các loại bánh xe đẩu từ nhựa, PU, cao su. Thực hiện quyền phân phối.|0.00|188/GP-KCN-ĐN|061-3569236/37-061-3569238|2002-12-19 00:00:00||KCN7|||50|5500000.00||Dai Shin Electro-Mechanical Corp|Đài Loan|2002-12-19 00:00:00|Cty TNHH Quốc tế Nguyên Hưng (tên cũ là CP Cơ điện Đại Tân)|||
635|Sx bộ truyền động, trục hộp số, trục bánh răng, bánh răng hộp số và một số linh kiện cơ khí dùng cho máy móc, phương tiện sử dụng động cơ và công cụ điện. Thực hiện quyền xuất khẩu, quyền nhập khẩu.|0.00|189/GP-KCN-ĐN|061-3560088/38-061-3560039|2002-12-26 00:00:00||KCN7|||50|7500000.00||Elma Vietnam Industry Co., Ltd|Đài Loan|2002-12-26 00:00:00|Cty TNHH Công nghiệp Elma Việt Nam|||
636|Sx, gia công chi tiết, linh kiện bằng nhôm dùng cho động cơ điện, sx các loại mô tơ công nghiệp và dân dụng|0.00|200/GP-KCN-ĐN|061-3560095-061-3560091|2003-02-25 00:00:00||KCN7|||50|1500000.00||Song Shyr Industrial Co., Ltd|Đài Loan|2003-02-25 00:00:00|Cty TNHH Công nghiệp Thông Thật|||
637|Sx linh kiện phụ tùng ô tô, gắn máy, sx các công cụ bằng kim loại, sx khuôn mẫu cho các sp kim loại và phi kim loại, xử lý nhiệt, mạ các sp nêu trên.|0.00|237/GP-KCN-ĐN|061-3560188/89-061-3560187|2003-09-26 00:00:00||KCN7|||50|3750000.00||Tai-Tech Forge Industrial Co., Ltd |Đài Loan|2003-09-26 00:00:00|Cty TNHH Công nghiệp Tai-Tech|||
