id|business_domain|chartered_capital|license|contact_address|date_of_licence|description|implement_address|implement_comments|implement_due_date|implement_duration|investment_capital|invesment_model|investor|investor_country|issue_date|name|parent_id|visible|activated
935|Sx sợi và dệt vải. Hoàn thiện sp dệt. In trên các sp dệt|0.00|441/GP-KCN-ĐN|061-3514162/88-061-3514160|2006-01-24 00:00:00||KCN15|||50|33000000.00||Samil Vina Co., Ltd|Hàn Quốc|2006-01-24 00:00:00|Cty TNHH Samil Vina|||
936|Sx các loại hóa chất dùng trong ngành công nghiệp. Thực hiện quyền xuất khẩu, quyền nhập khẩu|0.00|454/GP-KCN-ĐN|061-3514181-061-3514182|2006-03-06 00:00:00||KCN15|||50|1000000.00||Daimosa Technology (Viet Nam) Co., Ltd|Đài Loan|2006-03-06 00:00:00|Cty TNHH Công nghệ Daimosa (Việt Nam)|||
937|Chế biến các loại cà phê|0.00|461/GP-KCN-ĐN|061-3514200/01-061-3514202|2006-05-04 00:00:00||KCN15|||50|3500000.00||Hiang Kie Industries Ltd|Singapore|2006-05-04 00:00:00|Cty TNHH Hiang Kie Industries|||
938|Sx linh kiện, thiết bị, phụ tùng dùng trong ngành điện và thực hiện dịch vụ thiết kế, lắp đặt, sửa chữa, bảo trì và tư vấn kỹ thuật.Sản xuất thiết bị điện gia dụng, điện lạnh Thực hiện quyền nhập khẩu.|0.00|472/GP-KCN-ĐN|061-3514136/37/56/57-061-3514138|2006-06-02 00:00:00||KCN15|||50|6000000.00||Teco Technology (VietNam) Co., Ltd|Đài Loan|2006-06-02 00:00:00|Cty TNHH Công nghệ Teco (Việt Nam) (thuê nhà xưởng của Điện cơ Teco)|||
939|Sx các sản phẩm da tổng hợp (Polyurethane), vải không dệt thành phẩm và giấy dán tường. Cho thuê nhà xưởng (thời hạn cho thuê 24/01/2011). Sản xuất, gia công hóa chất sử dụng làm dung môi trong quá trình sản xuất sản phẩm nhựa và dung môi tổng hợp.|0.00|480/GP-KCN-ĐN|061-3514271/270-061-3514271|2006-06-28 00:00:00||KCN15|||50|16177000.00||Daewon Chemical Vina Co., Ltd|Hàn Quốc|2006-06-28 00:00:00|Cty TNHH Daewon Chemical Vina|||
940|Sx các loại bàn ghế, nội thất. Thực hiện quyền xuất khẩu, nhập khẩu.|0.00|487/GP-KCN-ĐN|-|2006-06-30 00:00:00||KCN15|||50|450000.00||AX-Designs Co., Ltd|Thái Lan|2006-06-30 00:00:00|Cty TNHH AX- Thiết kế|||
941|Sx các loại chỉ|0.00|488/GP-KCN-ĐN|061-3514250/53-061-3514249|2006-06-30 00:00:00||KCN15|||50|2800000.00||Jiin Huei Co., Ltd|Đài Loan|2006-06-30 00:00:00|Cty TNHH Jiin Huei|||
942|Sx các loại vỏ nang rỗng (capsule) dùng trong dược phẩm theo nguyên tắc, tiêu chuẩn GMP của tổ chức Y tế thế giới (GMP-WHO) (bao gồm công đoạn in trên các loại vỏ nang rỗng do Cty sản xuất)|0.00|473042000007|-|2006-09-11 00:00:00||KCN15|||50|40000000.00||Suheung Vietnam Co., Ltd|Hàn Quốc|2006-09-11 00:00:00|Cty TNHH Suheung Việt Nam|||
943|Sx hoá mỹ phẩm bao gồm mỹ phẩm, sp vệ sinh cá nhân, sp vệ sinh gia dụng, nước xịt phòng, nước làm mềm vải, các chất tẩy rửa. Cho thuê nhà xưởng, văn phòng (thực hiện ngoài trụ sở chính).|0.00|473042000012|08-62915600/01 -0983776638-08-62915602|2006-10-16 00:00:00||KCN15|||50|8000000.00||Mao Bao VietNam INC|Samoa|2006-10-16 00:00:00|Cty TNHH Mao Bảo Việt Nam|||
944|Sx vòi nước, phụ kiện bằng kim loại dùng cho nhà tắm và các thiết bị vệ sinh, thiết bị phòng tắm. Sx các loại khóa, ổ khoá, then cài, móc, ke, chốt cửa và các sp kim khí dùng cho xây dựng|0.00|473042000014|061-3514300-|2006-10-24 00:00:00||KCN15|||50|3000000.00||Kingpo Hardware Co., Ltd|Samoa-Đài Loan|2006-10-24 00:00:00|Cty TNHH Công nghiệp kim khí Kingpo|||
945|Sx các loại keo Polyurethane và keo màu|0.00|472023000020|061-3514313-061-3514312|2006-11-21 00:00:00||KCN15|||50|8000000.00||ILSam Vietnam|Hàn Quốc|2006-11-21 00:00:00|Cty TNHH ILSam Việt Nam|||
946|Sx nhựa tổng hợp PVC, Polyethylene khâu mạch (XLPE) và PE; Sx nhựa ABS và Recycle PET|0.00|472023000025|061-3514383-061-3514386|2006-11-28 00:00:00||KCN15|||50|6150000.00||Polycom Co., Ltd|Hàn Quốc|2006-11-28 00:00:00|Cty TNHH Polycom|||
947|Sx chất xử lý bề mặt, phụ liệu kích hoạt nhuộm, chất hồ vải|0.00|457/GP-HCM-KCN-ĐN|-|2005-05-10 00:00:00||KCN15|||50|900000.00||Dong Lim Vina Chemical Co., Ltd|Hàn Quốc|2005-05-10 00:00:00|Cty TNHH Dong Lim Vina Chemical|||
948|Sx dây hàn và que hàn điện|0.00|472043000061|-|2007-01-29 00:00:00||KCN15|||50|9000000.00||Chosun Vina Company Limited|Hàn Quốc|2007-01-29 00:00:00|Cty TNHH Chosun Vina|||
949|Sx các loại két sắt và thiết bị an toàn dành cho ngân hàng|0.00|472023000068|-|2007-02-08 00:00:00||KCN15|||50|2000000.00||Castle Safe Two Member Limited Liability Company|Hàn Quốc|2007-02-08 00:00:00|Cty TNHH Hai thành viên két sắt Castle|||
950|Sx các sản phẩm từ công nghệ đúc sẵn, xử lý và tráng phủ kim loại, cung cấp các hoạt động về kiến trúc, dịch vụ tư vấn công nghệ, kỹ thuật,  xây dựng các công trình dân dụng và công nghiệp|0.00|472043000077|061-3514336-061-3514224|2007-02-13 00:00:00||KCN15|||50|16000000.00||KJ Engineering & Constrution Company Limited|Hàn Quốc|2007-02-13 00:00:00|Cty TNHH Kỹ thuật và xây dựng KJ|||
951|In trên các loại vải và các sản phẩm bằng vải. Cho thuê nhà xưởng|0.00|472023000091|061-3514220-061-3514221|2007-03-05 00:00:00||KCN15|||50|10000000.00||NSK Global Textile, INC.|Hàn Quốc-Mỹ|2007-03-05 00:00:00|Cty TNHH NSK Global Textile|||
952|Sx các loại găng tay chuyên dụng (găng tay y tế, găng tay công nghiệp, găng tay thể thao...)|0.00|472043000116|061-3934013-061-3934013|2007-04-17 00:00:00||KCN15|||50|9000000.00||Midas Vina Corporation|Hàn Quốc|2007-04-17 00:00:00|Cty TNHH Midas Vina|||
953|Sx và gia công các loại pin dùng cho các sản phẩm điện tử như máy tính, điện thoại…|0.00|472043000120|-|2007-04-25 00:00:00|||||50|0.00||Vietnam Center Power Tech|Trung Quốc|2007-04-25 00:00:00|Chi nhánh Cty TNHH Việt Nam Center Power Tech (1)|||
954|Sx các loại hạt nhựa, nhựa nguyên liệu dùng trong quá trình sx sp nhựa, sx các sp nhựa dùng trong gia dụng và công nghiệp, sx các loại khuôn mẫu bằng nhựa, sx các loại sơn và mực in, sx các loại hạt màu. Xử lý và tráng p|0.00|472043000123|061-3514260/61/62-061-3514259|2007-05-02 00:00:00||KCN15|||50|1000000.00||Kumo Vina Inc|Hàn Quốc|2007-05-02 00:00:00|Cty TNHH Kumo Vina|||
955|Sơ chế, gia công, chế biến các sp nông nghiệp, chủ yếu là cà phê và ca cao, cung cấp dịch vụ lưu kho|0.00|47212000127|-|2007-05-03 00:00:00||KCN15|||50|3400000.00||Branch of Vinacof Ltd In Dong Nai|Mỹ|2007-05-03 00:00:00|Chi nhánh Cty TNHH cà phê Vĩnh An tại Đồng Nai|||
956|Sơ chế, chế biến cà phê|0.00|472023000130|061-3514256-061-3514286|2007-05-04 00:00:00||KCN15|||50|4900000.00||Cafeco Vietnam Co., Ltd|Ý-Nevis-British Virgin Islands|2007-05-04 00:00:00|Cty TNHH Cafeco Việt Nam|||
957|Sx các loại vải thành phẩm|0.00|472043000204|-|2007-07-30 00:00:00||KCN15|||50|1000000.00||Intex Co., Ltd|Hàn Quốc|2007-07-30 00:00:00|Cty TNHH Intex|||
958|Sx linh kiện điện tử, pin gia đình và phụ tùng tự động|0.00|472023000209|-|2007-08-03 00:00:00||KCN15|||50|6000000.00||Perfect Vision Co., Ltd|Đài Loan-Samoa|2007-08-03 00:00:00|Cty TNHH Perfect Vision|||
959|Sx và lắp ráp ống kính kỹ thuật số và các thiết bị điện tử khác, sx và lắp ráp các loại thấu kính, phụ kiện bằng kim loại, khuôn bằng nhựa tổng hợp dùng trong máy ảnh kỹ thuật số, sx và lắp ráp thiết bị và linh kiện điều trị nội soi. SX máy ảnh kỹ thuật số|0.00|472043000286|061-3514555-061-3514779|2007-10-31 00:00:00||KCN15|||50|110000000.00||Olympus Vietnam Co., Ltd|Nhật Bản|2007-10-31 00:00:00|Cty TNHH MTV Olympus Việt Nam  (DN chế xuất)|||
960|Sx, gia công các loại chỉ sợi, dây đai và dây ruy băng, các loại móc khoá và phụ kiện kỹ thuật gắn trên dây đai, các phụ kiện của túi xách, vali bằng chất liệu nhựa tổng hợp, vải sợi hoặc kim loại và các sp may mặc|0.00|472023000318|061-3514304/05/06-061-3514307|2007-11-22 00:00:00||KCN15|||50|2600000.00||Janisset Vietnam Co., Ltd|Pháp-Trung Quốc (Hồng Kông)|2007-11-22 00:00:00|Cty TNHH Janisset Việt Nam|||
961|Sản xuất móc áo và phụ kiện mắc áo bằng kim loại và nhựa|0.00|247/GP-KCN-ĐN|061-3993169-061-993157|2003-11-12 00:00:00||KCN15|||50|9000000.00||Mainetti (Vietnam) Co., Ltd|Singapore|2003-11-12 00:00:00|Cty TNHH Mainetti (Việt Nam) (chuyển từ Amata)|||
962|Sx đồ dùng cho trẻ em (bình sữa, núm vú, bình uống nước, bàn chải rửa bình sữa,…). Sx mỹ phẩm dùng cho trẻ em (dầu gội đầu, sữa tắm, phấn,…). Sx dụng cụ cho trẻ em (dụng cụ đo nhiệt độ, kem đánh răng, bàn chải đánh răng, Thực hiện quyền xuất khẩu, quyền nhập khẩu.|0.00|447/GP-KCN-ĐN|08-5127317-08-5106230|2006-02-08 00:00:00||KCN15|||50|6000000.00||Angel Vietnam Joint Stock Company|Hàn Quốc|2006-02-08 00:00:00|Cty CP Angel Việt Nam (chuyển từ Tam Phước)|||
963|Sx vải không dệt|0.00|472043000382|061-3514337/338-061-3514340|2008-01-29 00:00:00||KCN15|||50|2775000.00||NK Bio Vina Co.,LTD|Hàn Quốc|2008-01-29 00:00:00|Cty TNHH NK Bio Vina (thuê nhà xưởng Cty TNHH Daewon Chemical  Vina)|||
964|Sx các loại trục in bằng nhựa PU, máy móc thiết bị ngành in, các SP nhựa dùng trong gia dụng, các thiết bị dùng trong ngành trang trí và phủ bề mặt sản phẩm|0.00|472043000397|-|2008-02-04 00:00:00||KCN15|||50|5000000.00||Tongye Co., LTD|Đài Loan|2008-02-04 00:00:00|Cty TNHH Tongye|||
965|SX phụ tùng và bộ phận phụ trợ cho xe có động cơ và động cơ xe|0.00|47212000472|061-6258340-061-6258350|2008-05-19 00:00:00||KCN15|||50|81120000.00|||ĐỨC|2008-05-19 00:00:00|Chi nhánh Cty TNHH Robert Bosch Việt Nam|||
966|Sx các sp nhựa dùng cho khuôn mẫu bằng thép, SX ống giấy chứa que hàn, kệ để đồ bằng gỗ Palet|0.00|472043000501|061-2807006/007-061-2807008|2008-06-11 00:00:00||KCN15|||50|500000.00|||Hàn Quốc|2008-06-11 00:00:00|Cty TNHH MTV Boo Seong Vina|||
967|Sx các loại đầu thép đấu với cọc bêtông, Sx các sản phẩm thép dùng trong ngành xây dựng|0.00|472023000509|-|2008-06-17 00:00:00||KCN15|||50|3400000.00|||Hàn Quốc|2008-06-17 00:00:00|Cty TNHH Daeyang Vina Precision|||
968|Sản xuất các loại ống lăn in hoa văn trên gạch men và các thiết bị liên quan.|0.00|472043000667|061-3514508-061-3514510|2008-09-17 00:00:00||KCN15|||50|550000.00|||Trung Quốc|2008-09-17 00:00:00|Cty TNHH Việt Nam Yuncheng Laser Plate Making (thuê nhà xưởng của Cty Điện cơ Teco)|||
969|Sản xuất các loại khuôn nhựa và các bộ phận bằng nhựa của giày thể thao.|0.00|472043000677|-|2008-09-23 00:00:00||KCN15|||50|5500000.00||Framas Korea Vina Company Limited|Trung Quốc (Hong Kong)|2008-09-23 00:00:00|Cty TNHH Framas Korea Vina|||
970|Sản xuất các loại ống bằng nhựa sử dụng cho ngành công nghiệp và dân dụng|0.00|472043000697|-|2008-10-17 00:00:00||KCN15|||50|5000000.00|||Hàn Quốc|2008-10-17 00:00:00|Cty TNHH Ponaflex Việt Nam|||
971|Sx và gia công các loại khung bản in dùng trong công nghệ in kỹ thuật số (không bao gồm công đoạn in ấn)|0.00|472043000706|-|2008-11-07 00:00:00||KCN15|||50|1000000.00|||Hàn Quốc|2008-11-07 00:00:00|Cty TNHH Taekwang Screen|||
972|Sx lò xo, các chi tiết kim loại định hình dùng trong công nghiệp|0.00|411/GP-KCN-ĐN|-|2005-08-04 00:00:00||KCN17|||50|1160000.00||Vietnamese Spring Company Ltd|Ba Lan|2005-08-04 00:00:00|Cty TNHH Lò Xo Việt Nam|||
973|Sx các loại sản phẩm gỗ từ nguồn gỗ hợp pháp|0.00|472023000565|-|2008-07-09 00:00:00||KCN17|||50|1600000.00|||Hàn Quốc|2008-07-09 00:00:00|Cty TNHH Kyung Rim Vina|||
974|Sx đá đánh bóng, đá nhám; sx hàng thủ công mỹ nghệ mây, tre, lá; sx nguyên liệu phục vụ cho đánh bóng, xử lý kim loại dùng trong công nghiệp; sản xuất, lắp ráp và gia công máy móc cơ khí (máy chấn động và máy móc phục vụ cho ngành công nghiệp)|0.00|472022000728|-|2008-12-31 00:00:00||KCN17|||50|562000.00|||Việt Nam - Đài Loan|2008-12-31 00:00:00|Cty TNHH Đại Quang Minh|||
975|Sx bán thành phẩm giày, phom giày và các loại giày.Sx các loại thớt nhựa dùng cho ngành giày, áo đồng phục|0.00|479/GP-KCN-ĐN|061-3743800-061-3743851|2006-06-23 00:00:00||KCN18|||50|60000000.00||Viet Nam Dona Standard Footwear Co., Ltd|British Virgin Islands|2006-06-23 00:00:00|Cty TNHH Giày Dona Standard Việt Nam|||
976|Sx các loại dây cáp điện, các loại máy dùng trong ngành nông nghiệp, hệ thống điều hòa không khí, hệ thống phun nhựa, sx các loại cửa và khung vách ngăn làm bằng nhôm, các loại cáp thông tin, cáp tín hiệu, sx các loại cáp quang; thực hiện các dịch vụ có liên quan đến sản phẩm do doanh nghiệp sx.. Thực hiện quyền xuất khẩu, nhập khẩu|0.00|473042000008|-|2006-09-12 00:00:00||KCN19|||50|48000000.00|||Hàn Quốc|2006-09-12 00:00:00|Cty TNHH LS Cable Việt Nam|||
978|SX Giày thể thao, bán thành phẩm giày thể thao và hàng may mặc xuất khẩu|0.00|938|061 -3865201-061-3865145|1994-08-08 00:00:00||KCN20|||50|80000000.00||Chang Shin VN Co.,LTD|Hàn Quốc|1994-08-08 00:00:00|Cty Chang Shin Việt Nam TNHH|||
979|Sx các loại khuôn mẫu cho ngành sản xuất giày|0.00|96/GP-ĐN|061-3966622-061-3966570|2005-05-05 00:00:00||KCN20|||50|5000000.00||Chang Shin Technology Vietnam Co., Ltd|mỹ|2005-05-05 00:00:00|Cty Công nghệ Chang Shin Việt Nam|||
980|Sx sản phẩm may mặc xuất khẩu|0.00|472042000002|-|2006-09-29 00:00:00||KCN20|||50|2000000.00||Spring Fashion VN Co., Ltd|Mỹ|2006-09-29 00:00:00|Cty TNHH Spring Fashion Co., Ltd|||
981|Sx thức ăn gia súc, chất phụ gia cho thức ăn gia súc và thức ăn thủy sản. Thực hiện quyền xuất khẩu, nhập khẩu. Sx thức ăn gia cầm|0.00|26/GP-ĐN|061-3921919-21-061-3921915|2001-02-07 00:00:00||KCN21|||50|7000000.00||Vietnam E.H Agricuture Co.,Ltd|Trung Quốc-British Virgin Islands|2001-02-07 00:00:00|Cty TNHH Nông nghiệp E.H Việt Nam|||
982|Sx, gia công các sản phẩm gỗ gia dụng cao cấp từ nguyên liệu gỗ xẻ, gỗ ván các loại nhập khẩu chính ngạch và các vật liệu khác. Thực hiện quyền xuất khẩu, quyền nhập khẩu.|0.00|34/GP-ĐN|061-3923188-061-3922139|2001-11-27 00:00:00||KCN21|||50|40000000.00||San Lim Furniture Co.,Ltd (VN)|British Virgin Islands|2001-11-27 00:00:00|Cty TNHH San Lim Furniture Việt Nam|||
983|Sx, gia công các sản phẩm trang trí nội thất bằng nguyên liệu sắt, kẽm, đồng, nhựa, poly, mây tre, gỗ, gia công xi mạ và gia công đúc các sp trang trí nội thất bằng kim loại|0.00|35/GP-ĐN|061-3922213/5-061-3922211|2001-12-07 00:00:00||KCN21|||50|4000000.00||Piing Heh Enterprise Co.,Ltd|Đài Loan|2001-12-07 00:00:00|Cty TNHH Piing Heh|||
984|Sx, gia công sản phẩm gỗ, nệm sofa bằng da. Sx ván MDF và các loại gỗ ghép thanh|0.00|2395/GP|061-3675085-061-3675084|2004-05-05 00:00:00||KCN21|||50|120000000.00||Shing Mark Enterprise Co., Ltd|Đài Loan|2004-05-05 00:00:00|Cty TNHH Shing Mark Vina|||
985|Sx và gia công giày dép, khuôn mẫu, dao chặt làm giày; sx phụ kiện giày và nguyên phụ liệu ngành giày; Xây dựng nhà xưởng cho các nhà đầu tư thuê để lập các cty sx hàng may mặc, hàng điện tử kỹ thuật cao và các cụm linh kiện điện tử, các công ty vệ tinh sx các nguyên liệu, phụ tùng để tăng tỷ lệ nội địa hóa trong sx sản phẩm xuất khẩu của DN. Sx các sản phẩm bằng nhựa (túi P.P, P.E các loại, thớt chặt...) Sx túi kệ đựng đồ dùng cá nhân các loại, sản phẩm văn phòng phẩm các loại; sx thùng rác các loại; sx các loại tấm lót, miếng lót từ nguồn nguyên liệu nhụa, vải các loại, sắt cuộn (que) và các tấm giả da.|0.00|2445/GP|061-3675145-48-061-3675149|2005-01-12 00:00:00||KCN21|||50|190000000.00||Pou Sung Vietnam Industrial Enterprise Ltd|Trung Quốc (Hồng Kông)|2005-01-12 00:00:00|Cty TNHH Pou Sung Việt Nam|||
986|Sx các loại sp và chi tiết bằng kim loại dùng cho xe gắn máy, máy tính và thiết bị công nghiệp|0.00|472023000099|061-3677562-061-3677561|2007-03-23 00:00:00||KCN21|||50|1000000.00||Stand Dragon Technology Company Limited|Đài Loan|2007-03-23 00:00:00|Cty TNHH Kỹ nghệ Stand Dragon|||
987|Sx thức ăn gia súc và thức ăn thủy sản. Thực hiện quyền xuât khẩu, nhập khẩu.|0.00|37/GP-ĐN|061-3923355-061-3923350|2002-01-22 00:00:00||KCN21|||50|15000000.00||Woosung Vina Co., Limited|Hàn Quốc|2002-01-22 00:00:00|Cty TNHH Woosung Việt Nam|||
988|Sx lò đốt công nghiệp, sx dây chuyền công nghệ tự động (băng chuyền, hệ thống giữ nhiệt, hệ thống phân loại sản phẩm, dây chuyền sản xuất túi xách)|0.00|472023000188|061-8825084-061-8825084|2007-07-16 00:00:00||KCN21|||50|2000000.00||Ooksan Vina Company Limited|Hàn Quốc|2007-07-16 00:00:00|Cty TNHH Ooksan|||
989|Sx các sản phẩm dệt kim và may mặc|0.00|103/GP-ĐN|061-3676679-061-3676680|2005-12-30 00:00:00||KCN21|||50|1200000.00||Mastex Vina Co., Ltd|Hàn Quốc|2005-12-30 00:00:00|Cty TNHH Mastex Việt Nam|||
990|SX các loại túi xách (túi xách du lịch, túi đựng thiết bị điện tử, cặp sách, ba lô…)|0.00|472043000357|061-8951160-061-8951157|2008-01-02 00:00:00||KCN21|||50|6000000.00||Starite Int'l VN LTD|British Virgin Islands|2008-01-02 00:00:00|Cty TNHH Starite International Việt Nam (thuê nhà xưởng của Cty Pou Sung)|||
991|Phủ bóng vải, thực hiện quyền xuất khẩu và nhập khẩu|0.00|472043000365|-|2008-01-07 00:00:00||KCN21|||50|1930000.00||Sedo camping CO., LTD|Hàn Quốc|2008-01-07 00:00:00|Cty TNHH Sedo Vina Tech|||
992|Sx hàng may sẵn (trừ trang phục)|0.00|47212000761|-|2009-10-26 00:00:00||KCN21|||50|5000000.00|||Hàn Quốc|2009-10-26 00:00:00|Chi nhánh Cty Han-Soll Vina (thuê nhà xưởng của Cty Sao Việt)|||
993|Sx va gia công máy công nghiệp và các phụ tùng, máy và phụ tùng dùng cho ngành điện, điện tử chính xác.|0.00|472043000436|-|2008-04-14 00:00:00||KCN22|||50|3400000.00|||Hàn Quốc|2008-04-14 00:00:00|Cty TNHH Iljin Việt Nam|||
994|Sản xuất giày thể thao các loại|0.00|47212000707|-|2008-11-20 00:00:00||KCN25|||50|16000000.00|||Hàn Quốc|2008-11-20 00:00:00|Chi  nhánh Cty CP Tae Kwang Vina Industrial|||
995|Sản xuất phôi thép, thép gân, thép khung, thép ống, thép tráng kẽm, thép cơ khí, thép tấm cán nguội, tôn mạ kẽm và mạ màu dạng cuộn, nắp máy và cửa xe ô tô|0.00|1586/GP|-|1996-06-03 00:00:00||KCN27|||50|200000000.00||Sun Steel Corporation|Cayman Islands-Nhật Bản|1996-06-03 00:00:00|Công ty TNHH Sun Steel|||
996|Pha chế dầu nhờn, hóa chất và các sản phẩm gốc dầu. Sx các loại bao bì như thùng, lon, chai, hộp để đóng gói sp dầu nhờn và hóa chất. Xây dựng cầu tàu chuyên dùng phục vụ cho hoạt động sản xuất kinh doanh của nội bộ doanh nghiệp liên doanh. Cho thuê bồn chứa, kho bãi và giao nhận nội địa đối với sp dầu nhờn, hóa chất và các sản phẩm gốc dầu.|0.00|33/GP-ĐN|08-9106883-08-9106887|2001-11-16 00:00:00||KCN27|||50|25000000.00||Vopak (Viet Nam) Co., Ltd|Singapore|2001-11-16 00:00:00|Công ty TNHH Vopak Việt Nam|||
997|Trồng 10.000 ha cây nguyên liệu giấy thông qua hợp đồng kinh tế với các tổ chức, cá nhân trong nước Việt Nam, Cắt dăm mảnh gỗ xuất khẩu. Khai thác cầu cảng chuyên dùng Phước Khánh|0.00|432A/GP|061-35126380-061-8999568|2002-02-06 00:00:00||KCN27|||50|9541000.00||Sanrimjohap Vina Co., Ltd|Hàn Quốc|2002-02-06 00:00:00|Công ty TNHH MTV  Sanrimjohap Vina|||
998|Xây dựng một trạm nghiền xi măng và một cầu cảng chuyên dùng phục vụ cho trạm nghiền xi măng đặt tại xã Phước Khánh, huyện Nhơn Trạch, tỉnh Đồng Nai|0.00|2301/GP|0613-570017-0613-570018|2003-01-09 00:00:00||KCN27|||50|27000000.00||Lafarge Cement Joint Venture Company|Việt Nam-Singapore|2003-01-09 00:00:00|Công ty LD Lafarge Xi Măng|||
999|Bột ngọt, tinh bột, acid xút|0.00|171|061 - 825111 -061-825137|1991-08-01 00:00:00||KCN16|||50|438819416.00|||Singapore|1991-08-01 00:00:00|Cty Cổ phần hữu hạn Vedan Việt Nam|||
1000|Sx giày dép các loại, các cấu kiện giày dép và nguyên phụ liệu để sản xuất giày dép; sx khuôn mẫu các loại dùng trong ngành giày dép.Giày thể thao|0.00|1045.0|061-3955220-061-3954224|1994-11-15 00:00:00||KCN16|||50|95000000.00|||Trung Quốc (Hong Kong)|1994-11-15 00:00:00|Cty TNHH Pou Chen Việt Nam ( tên cũ là Cty Hưng Nghiệp CP TNHH Pou chen Việt Nam)|||
1001|chế biến, đóng hộp các sản phẩm thuỷ sản xuất khẩu|0.00|5.32022000001E11|1051 North bay Boulevard, Navotas Metro Manila, Phlippines; GCNĐKKD: CS 200606405; Manila|2006-09-29 00:00:00||Cụm công nghiệp và Tiểu thủ công nghiệp Tân Mỹ Chánh|||49|3000000.00|72.5% vốn nước ngoài|Công ty TNHH Trinity Việt Nam|Philippine|2006-09-29 00:00:00|Công ty TNHH Trinity Việt Nam|||
1002|Xay xát thóc lúa, đánh bóng gạo, Sản xuất tinh bột và các sản phẩm khác từ tinh bột, Mua bán lương thực, thực phẩm|0.00|531022000019||2007-08-21 00:00:00||số 522, tổ 16, ấp An Hiệp, xã Đông Hoà Hiệp, huyện Cái Bè|||20|300000.00|45% vốn nước ngoài|Công ty TNHH Việt Phong|Đài Loan|2007-08-21 00:00:00|Thành l ập mới Doanh nghiệp chế biến kinh doanh XNK lương thực thực phẩm|||
1003|Sản xuất, gia công và xuất khẩu nút áo|0.00|531043000023|240-1, Anyang-Rí Saenglim Myeun,  thành phố Kimhae Kyeung - Hàn Quốc|2007-09-21 00:00:00||ấp Mỹ Tường, xã Mỹ Phước, huyện Tân Phước|||50|157000.00|70% vốn nước ngoài|Công ty TNHH Sản xuất nút áo Thành Công|Hàn Quốc|2007-09-21 00:00:00|Sản xuất nút áo Xuất khẩu|||
1004|Mua, bán vỏ dừa các loại , Mua, bán xơ dừa và các sản phẩm được sản xuất từ xơ dừa|0.00|531023000031|427 Saginaw Parkway, Cambridge, Ontario, Canada; |2007-03-12 00:00:00||số 2061 ấp Lạc Hoà, xã Bình Đông, huyện Gò Công Đông|||50|500000.00|100% vốn nước ngoài|Công ty TNHH Sản xuất xơ dừa KDD|Canada|2007-03-12 00:00:00|Dự án đầu tư thành lập Doanh nghiệp sản xuất kinh doanh xơ dừa, sản phầm sản xuất từ xở dừa cho xuất khẩu|||
1005|Sản xuất hộp kim loại các loại, để đựng thức ăn và / hoặc đồ uống|0.00|531043000033|60/7 Moo 6, Ekachai road, Bangkok 10150, Thái Lan|2007-12-24 00:00:00||lô 26, 27, 28, 35, 36 và 37, cụm công nghiệp - tiểu thủ công nghiệp Tân Mỹ Chánh, thành phố Mỹ Tho|||50|21000000.00|100% vốn nước ngoài|Công ty TNHH Royal Can Industries (Việt Nam)|Thái Lan|2007-12-24 00:00:00|Công ty TNHH Royal Can Industries (Việt Nam)|||
1006|Chế biến, xuất nhập khẩu thủy sản|0.00|531043000064|40 Woodlands Terrace Singapore 738456; GDKKD: 199306820N|2008-12-08 00:00:00||Cụm công nghiệp Tân Mỹ Chánh, thành phố Mỹ Tho|||50|5800000.00|100% vốn nước ngoài| Công ty TNHH 1TV Li Chuan Food Products (Việt Nam)|Singapore|2008-12-08 00:00:00|Nhà máy chế biến Thủy sản|||
1007|xây dựng khu phức hợp nghỉ dưỡng và sân golf Tiền Giang|0.00|531045000053|Phòng 4.7B, lầu 4, tòa nhà Etown, số 364 đường Cộng Hoà, phường 13, quận Tân Bình, thành phố Hồ Chí Minh|2008-07-14 00:00:00||xã Tân Lập 1, huyện Tân Phước|||50|80000000.00|100% vốn nước ngoài|Công ty TNHH 1TV Genuwin D&C Tiền Giang|Hàn Quốc|2008-07-14 00:00:00|Khu nghĩ dưỡng và sân GOLF Tiền Giang|||
1008|Sản xuất linh kiện điện tử và thiết bị gia dụng|0.00|531043000066|336, đại lộ Petunia, Coromandel, Cộng Hoà Mauritius|2008-12-24 00:00:00||số 426B, đường Trần Hưng Đạo, phường 4, thành phố Mỹ Tho|||20|412000.00|100% vốn nước ngoài|Công ty TNHH 1TV KATEMA Việt Nam|Cộng hòa Mauritius|2008-12-24 00:00:00|Thành lập mới cơ sở lắp ráp kinh doanh thiết bị điện tử điều khiển các trang thiết bị điện gia dụng và thiết bị điện sản xuất|||
